video_id,trending_date,title,channel_title,category_id,publish_time,tags,views,likes,dislikes,comment_count,thumbnail_link,comments_disabled,ratings_disabled,video_error_or_removed,description,state,lat,lon,geometry
LgVi6y5QIjM,17.14.11,Sing zu Ende! | Gesangseinlagen vom Feinsten | inscope21,inscope21,24,2017-11-13T17:08:49.000Z,"inscope21|""sing zu ende""|""gesangseinlagen""|""gesang""|""gesungen""|""songs nachsingen""|""nachsingen""|""songs covern""|""carpool karaoke""|""witziger gesang""|""rap""|""rap cover""|""rap zu ende""|""raps nachstellen""|""nachrappen""|""nach rappen""",252786,35885,230,1539,https://i.ytimg.com/vi/LgVi6y5QIjM/default.jpg,False,False,False,"Heute gibt es mal wieder ein neues Format... wenn euch das Ganze gefällt lasst 1,5 Daumen nach oben da, dann bringen wir es nie wieder. Es wird gerappt gesungen und nichts gewusst, optimales Setup also. Kommentiert welche Songs ihr nächstes Mal dabei haben wollt.\n\n►Merch!: https://www.inscope21.com/\n\nzu den Jungs: \n\nSascha: https://www.youtube.com/user/unsympathischtv\nShpendi: https://www.youtube.com/channel/UCm32Mjdv3OhNrDT-RXExViA\nPeter: https://www.youtube.com/channel/UCvZxLLwvrXrRf1mENhqJKkw\n\n( Die mit * gekennzeichneten Links sind Partner oder Sponsoren von mir - sprich über diese Links werden Einnahmen generiert)",Schleswig Holstein,54.78374778,9.433315388,POINT (9.433315388 54.78374778)
Bayt7uQith4,17.14.11,Kinder ferngesteuert im Kiosk! Erwachsene abzocken - LUKE! Die Woche und ich | SAT.1,LUKE! Die Woche und ich,23,2017-11-12T22:30:01.000Z,"Kinder|""ferngesteuert""|""Kinder ferngesteuert""|""luke mockridge kinder""|""luke die woche und ich kinder""|""Prank""|""verarschen""|""Kiosk""|""Funkgerät""|""Falschgeld""|""Verkäufer""|""Luke Mockridge""|""Luke Die Woche und ich""|""versteckte Kamera""|""Show""|""Sat.1""|""LDWUI""|""Comedy""|""Kioskverkäufer""|""kinder prank""|""luke robin""|""Erwachsene abzocken""|""kunden verarschen""|""kunden prank""|""kasse prank""|""versteckte Kamera luke""|""luke kinder""",797196,53576,302,1278,https://i.ytimg.com/vi/Bayt7uQith4/default.jpg,False,False,False,"Kinder ferngesteuert! Kinder lassen sich sooo leicht beeinflussen. So wie Robin, der sich von Luke als Kioskverkäufer steuern lässt. Die Kundern sind leicht irritiert.  \n\n►Abonniert den Kanal und verpasst kein „LUKE – Die Woche und ich“-Video!\nhttps://www.youtube.com/channel/UCC2I-hHgLHQ4dTAaOhErRRQ?sub_confirmation=1\n\n► „LUKE – Die Woche und ich“ auf Facebook:\nhttps://www.facebook.com/lukeswoche/\n\n► Die „LUKE – Die Woche und ich“-Webseite\nhttps://www.sat1.de/tv/luke-die-woche-und-ich\n\nEr ist charmant, frech und vor allem eins: unglaublich witzig. Luke Mockridge mischt mit seiner eigenen Show „LUKE! Die Woche und ich“ die deutsche Comedy-Szene ordentlich auf.\n\nImpressum:\nhttp://www.myspass.de/impressum/",Nordrhein Westfalen,52.02998822,8.530011351,POINT (8.530011351000001 52.02998822)
1ZAPwfrtAFY,17.14.11,The Trump Presidency: Last Week Tonight with John Oliver (HBO),LastWeekTonight,24,2017-11-13T07:30:00.000Z,"last week tonight trump presidency|""last week tonight donald trump""|""john oliver trump""|""donald trump""",2418783,97190,6146,12703,https://i.ytimg.com/vi/1ZAPwfrtAFY/default.jpg,False,False,False,"One year after the presidential election, John Oliver discusses what we've learned so far and enlists our catheter cowboy to teach Donald Trump what he hasn't.\n\nConnect with Last Week Tonight online...\n\nSubscribe to the Last Week Tonight YouTube channel for more almost news as it almost happens: www.youtube.com/user/LastWeekTonight\n\nFind Last Week Tonight on Facebook like your mom would: http://Facebook.com/LastWeekTonight\n\nFollow us on Twitter for news about jokes and jokes about news: http://Twitter.com/LastWeekTonight\n\nVisit our official site for all that other stuff at once: http://www.hbo.com/lastweektonight",Saarland,49.25039044,6.970003213,POINT (6.970003213 49.25039044)
AHtypnRk7JE,17.14.11,Das Fermi-Paradoxon,100SekundenPhysik,27,2017-11-12T15:00:01.000Z,"Physik|""Wissenschaft""|""Technik""|""Science-Fiction""|""Außerirdische""|""Alien""|""Aliens""|""Fermi""|""Fermi-Paradoxon""",380247,31821,458,1955,https://i.ytimg.com/vi/AHtypnRk7JE/default.jpg,False,False,False,"►Alle Videos: http://bit.ly/1fa7Tw3\n\n\n✚Snapchat: SekundenPhysik\n✚Facebook: http://on.fb.me/YJFlNt\n✚Twitter: http://bit.ly/Zqqnv4\n✚Abonnieren: http://bit.ly/10jgdi2\n\n100SekundenPhysik: das ist Wissenschaft in einfacher, knapper und unterhaltsamer Form.",Bayern,50.26660748,10.96660681,POINT (10.96660681 50.26660748)
ZJ9We4bjcg0,17.14.11,18 SONGS mit Kelly MissesVlog (Sing-off),rezo,24,2017-11-12T13:10:36.000Z,"kelly|""missesvlog""|""kelly song""|""bausa""|""bausa was du liebe nennst""",822213,100684,2467,10244,https://i.ytimg.com/vi/ZJ9We4bjcg0/default.jpg,False,False,False,18 Song Mashup über den (veränderten) Beat von Bausa - Was Du Liebe Nennst mit der lieben Kelly aka MissesVlog.\nKellys Video: https://youtu.be/1ZMZTC67F6k\nMEIN SHOP: http://www.rezo-shop.de\n\n► FOLGT MIR\nInstagram: http://instagram.com/rezomusik\nTwitter: https://twitter.com/rezomusik\nFacebook: https://www.facebook.com/rezomusik/\nSnapchat: rezomusik,Berlin,52.52181866,13.40154862,POINT (13.40154862 52.52181866)
xapGFgWqtg4,17.14.11,Geld verdienen mit Online-Umfragen? Geht das wirklich? 😱,Die Allestester,22,2017-11-13T01:49:24.000Z,[none],32709,3093,296,63,https://i.ytimg.com/vi/xapGFgWqtg4/default.jpg,False,False,False,"Wir haben Meinungsstudie.de (► http://bit.ly/2wiA2wv ◄) getestet und wir haben einen 20€ Amazon Gutschein ausgezahlt bekommen. FAZIT: Geld verdienen durch Umfragen ausfüllen FUNKTIONIERT ► Unser Tipp: Bei mehreren Seiten anmelden und überall Umfragen ausfüllen, dann kann man direkt den Verdienst deutlich erhöhen.\n\n♦Meinungsstudie (Gutschein kam): http://bit.ly/2wiA2wv\n♦GfK Institut (funktioniert): http://bit.ly/2z0IOQJ\n♦Nicequest (auch super): http://bit.ly/2g7OogG\n♦MySurvey (funktioniert): http://bit.ly/2xtLTvN\n♦Trendfrage (funktioniert): http://bit.ly/2yEkipq\n♦YouGov (funktioniert): http://bit.ly/2yVdD9z\n▬▬▬▬▬▬▬▬▬▬▬▬▬▬▬▬▬▬▬▬▬▬",Hessen,51.30000694,9.500029662,POINT (9.500029661999999 51.30000694)
EIM7RMe39JY,17.14.11,Kanaken auf der Klassenfahrt,Bodyformus,23,2017-11-13T11:59:04.000Z,"kanaken|""kurden""|""türken""|""schule""|""schulzeit""|""hauptschule""|""realschule""|""kinder""|""bodyformus""|""prototyp""|""barry hammerschmidt""|""barry""|""noten""|""leherer""|""rap""|""musik""|""hip hop""",308683,35704,578,1398,https://i.ytimg.com/vi/EIM7RMe39JY/default.jpg,False,False,False,Video mit Planet Kanax: https://youtu.be/3U51cVIqulM\n\nVideo mit Nelson: https://youtu.be/yszbBUrSVag\n\nhttps://www.Instagram.com/bodyformus_\n\nwww.facebook.com/Bodyformus,Rheinland Pfalz,49.98247246,8.273219156,POINT (8.273219156 49.98247246)
PaWTaj6Iie0,17.14.11,3 unbekannte Gesichter von Film/Serien-Charakteren (die wir enthüllen!),Jay & Arya,22,2017-11-13T18:09:55.000Z,"unbekannte gesichte charakter|""unbekannte gesichter animierte charakter""|""unbekannte gesichter film serien charakter""|""wir enthüllen unbekannte gesichter""|""howard wolowitz mom""|""mrs wolowitz gesicht""|""blair witch project hexe gesicht""|""how i met your mother kürbisschlampe""|""kürbisschlampe gesicht""|""kürbis schlampe gesicht""|""jay und arya""|""jay und arya film geek""|""film geek""",181660,17998,169,554,https://i.ytimg.com/vi/PaWTaj6Iie0/default.jpg,False,False,False,4 unbekannte Gesichter animierter Charaktere (die wir enthüllen!) ► https://www.youtube.com/watch?v=Rtt1OK94PeU \n\nUnser neuster Kurzfilm MR_ROBOT.exe - Teil 1 ► https://www.youtube.com/watch?v=X-mf77RwM6g\n\n_______________\nFacebook ► https://www.facebook.com/JayAndArya\n_______________\n\nArya Lee\nSnapchat - AryaLeee\nInstagram - http://instagram.com/arya__lee (@arya__lee)\nTwitter - https://twitter.com/Arya__Lee (@arya__lee)\n\nJay Samuelz\nSnapchat - jay.samuelz\nInstagram - http://instagram.com/jaysamuelz (@JaySamuelz)\nTwitter - https://twitter.com/JaySamuelz (@JaySamuelz)\n\n______________\n\nMusik :\nVincent Lee,Nordrhein Westfalen,52.02998822,8.530011351,POINT (8.530011351000001 52.02998822)
GHct2dGNLks,17.14.11,Antoine leiht Auto von Ernährungsberaterin,TeddyComedy,23,2017-11-12T11:53:45.000Z,"Antoine Auto|""Antoine Boot Camp""|""Antoine Ernährungsberaterin""|""Ernährungsberaterin""|""Antoine leiht Auto""|""antoine wellensittich""|""Umfrage zum Integrationstest""|""Best of Antoine""|""3 Stufen""|""smalltalk""|""teddycomedy""|""antoine""|""flieg klein wellensittich""|""integrationstest""|""angelo mert""|""domian""|""teddy""|""wellensittich""|""menschlich gesehen ziemlich abstossend""|""zamanta""|""boot camp""|""was labersch du""|""sido""|""30 11 80""",369173,16953,570,611,https://i.ytimg.com/vi/GHct2dGNLks/default.jpg,False,False,False,Antoine hat sich ein Auto ausgeliehen..schaut mal was passiert.\n\nViel Spass :)\n\nAbonniere den Kanal um kein Video zu verpassen.\n\nTickets für die neue Teddy Show:\nhttp://bit.ly/2zpV8LY\n\nWebseite:\nhttp://teddy-show.de/\n\nWas labersch Du....\nFan-Shop:\nhttp://www.teddy-sein-laden.de/\n\nTeddyShow Live-DVD bei Amazon:\nhttp://amzn.to/1Z6evAJ\n\nFacebook:\nhttps://www.facebook.com/Teddy.Comedy\n\nMusic by:\nhttps://soundcloud.com/blinisnow,Thuringen,50.97005292,11.02996212,POINT (11.02996212 50.97005292)
aZYSFByDGkg,17.14.11,Legenden: So wird dein Ruhm unsterblich - Fame Academy | WALULIS,WALULIS,1,2017-11-13T15:06:12.000Z,"michael jackson|""promi""|""tot""|""tod""|""gestorben""|""promiflash""|""ruhm""|""prominenz""|""celebrities""|""david bowie""|""warum sterben soviele promis""|""legenden""|""2016""|""unsterblich""|""fame academy""|""walulis""",62418,4749,44,425,https://i.ytimg.com/vi/aZYSFByDGkg/default.jpg,False,False,False,"Berühmt werden kann jeder, aber berühmt bleiben ist schwierig. Was unterscheidet Promi-Legenden von den Stars, die nach kurzer Zeit wieder in der Versenkung verschwinden? Wir zeigen dir, wie man seinen Platz im Promi Olymp verteidigt!\n\n→ Wir sind Teil von funk! Mehr davon gibt's unter:\n►YouTube: https://youtube.com/funkofficial\n►funk Web-App: https://go.funk.net\n►Facebook: https://facebook.com/funk\n►Impressum: https://go.funk.net/impressum\n\n→ Mehr von WALULIS:\n►Jetzt diesen Kanal abonnieren: http://walul.is/2meZD40\n►Newsletter mit intimen Details aus der Redaktion abonnieren: http://walul.is/2j0zogu\n►WALULIS bei Facebook: http://walul.is/2lez2Xu\n►WALULIS' Rechtschreibfehler auf Twitter korrigieren: http://walul.is/2vsqDFh \n►Bunte Bilder aus der Redaktion auf Insta: http://walul.is/2qTVHMW",Thuringen,50.97005292,11.02996212,POINT (11.02996212 50.97005292)
2hu_evXPpMM,17.14.11,Dagi Bee wird Heiraten | Coldmirror bekommt Ehrenpreis | YouTube Trends,HerrNewstime,24,2017-11-12T16:33:18.000Z,"Dagi Bee|""Heiraten""|""Coldmirror""|""YouTube""|""Trends""",228574,11349,990,1049,https://i.ytimg.com/vi/2hu_evXPpMM/default.jpg,False,False,False,Dagi Bee wird Heiraten | Coldmirror bekommt Ehrenpreis | YouTube Trends\nTwitter: http://twitter.com/HerrNewstime / SNAP: herrnewstime\nMusik: Bosstransformation Theme Beat - Bosshafte Beats / First Class Travel - Bosshafte Beats\n\nAHH! Wir haben einen HOCHZEITSTERMIN - Dagi Bee\nhttps://www.youtube.com/watch?v=G3rHvAD-bew\n\nYoutube-Star Coldmirror erhält Sondermann-Förderpreis\nhttps://www.extratipp.com/rhein-main/frankfurt-youtube-star-coldmirror-kathrin-fricke-erhaelt-sondermann-foerderpreis-9267891.html\n\nDas HerrNewstime Studio\nhttps://www.youtube.com/watch?v=DFwn8co8d1g\n\n\nImpressum / Inhaltliche Ausrichtung\nhttps://www.youtube.com/HerrNewstime/about\n\n►Bosshaft!\nhttps://www.youtube.com/BosshafteBeats\n\n------------------------------------------------\n\nDISCORD SERVER (Voice / Chat)\n\nServer Adresse: http://discord.gg/HerrNewstime\n\n------------------------------------------------\nHier bin ich auch :D\n\n► Twitter: http://twitter.com/HerrNewstime\n► Facebook Profil: http://facebook.com/HerrNewstimePrivat\n► Facebook: http://facebook.com/HerrNewstime,Thuringen,50.97005292,11.02996212,POINT (11.02996212 50.97005292)
2kyS6SvSYSE,17.14.11,WE WANT TO TALK ABOUT OUR MARRIAGE,CaseyNeistat,22,2017-11-13T17:13:01.000Z,SHANtell martin,748374,57532,2966,15954,https://i.ytimg.com/vi/2kyS6SvSYSE/default.jpg,False,False,False,SHANTELL'S CHANNEL - https://www.youtube.com/shantellmartin\nCANDICE - https://www.lovebilly.com\n\nfilmed this video in 4k on this -- http://amzn.to/2sTDnRZ\nwith this lens -- http://amzn.to/2rUJOmD\nbig drone - http://tinyurl.com/h4ft3oy\nOTHER GEAR ---  http://amzn.to/2o3GLX5\nSony CAMERA http://amzn.to/2nOBmnv\nOLD CAMERA; http://amzn.to/2o2cQBT\nMAIN LENS; http://amzn.to/2od5gBJ\nBIG SONY CAMERA; http://amzn.to/2nrdJRO\nBIG Canon CAMERA; http://tinyurl.com/jn4q4vz\nBENDY TRIPOD THING; http://tinyurl.com/gw3ylz2\nYOU NEED THIS FOR THE BENDY TRIPOD; http://tinyurl.com/j8mzzua\nWIDE LENS; http://tinyurl.com/jkfcm8t\nMORE EXPENSIVE WIDE LENS; http://tinyurl.com/zrdgtou\nSMALL CAMERA; http://tinyurl.com/hrrzhor\nMICROPHONE; http://tinyurl.com/zefm4jy\nOTHER MICROPHONE; http://tinyurl.com/jxgpj86\nOLD DRONE (cheaper but still great);http://tinyurl.com/zcfmnmd\n\nfollow me; on http://instagram.com/caseyneistat\non https://www.facebook.com/cneistat\non https://twitter.com/CaseyNeistat\n\namazing intro song by https://soundcloud.com/discoteeth\n\nad disclosure.  THIS IS NOT AN AD.  not selling or promoting anything.  but samsung did produce the Shantell Video as a 'GALAXY PROJECT' which is an initiative that enables creators like Shantell and me to make projects we might otherwise not have the opportunity to make.  hope that's clear.  if not ask in the comments and i'll answer any specifics.,Berlin,52.52181866,13.40154862,POINT (13.40154862 52.52181866)
2Zp-Qm3wJkA,17.14.11,JP Performance -  Quetschen wir den Japaner mal aus ! | Lexus RC-F,JP Performance,2,2017-11-13T10:30:01.000Z,"V8|""VMAX""|""Topspeed""|""Prüfstand""|""JP Performance""|""Jean Pierre Kraemer""|""PS Profis""|""JP""|""Boost""|""Turbo""|""Dortmund""|""Germany""|""Drift""|""Flames""|""Backfire""|""Antilag""|""Burnout""|""Loud""|""Exhaust""|""Abgasanlage""|""Tuning""|""VLOG""|""Fail""|""Compilation""|""BMW""|""M4""|""Audi""|""R8""|""Lamborghini""|""Ferrari""|""Bugatti""|""Veyron""|""VW""|""Golf""|""GTI""",465883,19928,216,1240,https://i.ytimg.com/vi/2Zp-Qm3wJkA/default.jpg,False,False,False,"Mal schauen was unser Japaner so kann! :D\n- - -\nHiermit filmen wir:\n* Haupt - Kamera | http://amzn.to/2uuB1Mk\n* VLOG - Kamera | http://amzn.to/2u0dqCi\n* Action - Kamera |  http://amzn.to/2u0rOuf\n* Objektiv Adapter | http://amzn.to/2uAchmI\n* Objektive | http://amzn.to/2u0IHFg + http://amzn.to/2u19IHf\n* Speicherkarte(n) | http://amzn.to/2vtnW2W\n* Stativ | http://amzn.to/2t7y4O4\n\nDie mit *  gekennzeichneten Links sind Affiliate Links, die zum Partnerprogramm von Amazon gehören. Solltet ihr etwas über diese Links kaufen, bekomme ich eine Vermittlungsprovision, natürlich ohne dass ihr dafür mehr bezahlen müsst.\n- - -\nFACEBOOK: https://goo.gl/CpAuI4\nINSTAGRAM: https://goo.gl/SxiVbk\nWEBSITE: http://goo.gl/MPbEzf\n- - -\n...Jean Pierre Kraemer / JP Performance GmbH - zwei Begriffe die für Spaß, Leistung, Power, freche Sprüche, schnelle Autos, Turbotechnik, Turboumbauten, Ladedruck und noch vieles mehr stehen.\nMit diesen Videos biete ich dir einen Einblick ins tägliche Leben hier in der Firma ,Leistungssteigerungen, technische Details & Erklärungen, Soundfiles, Messwerte, Vergleiche, Neuvorstellungen & Präsentationen und und und...\nDu bist quasi live bei all unseren Projekten, Events und Reisen in die große, weite Welt mit dabei. Egal ob Audi, BMW, Chrysler, Dodge, Ferrari, Ford, GMC, Honda, Infinity, Jaguar, Koenigsegg, Lamborghini, Mercedes, Nissan, Opel, Porsche, Range Rover, Skoda, Tesla, Volkswagen oder Wiesmann... es ist für jeden etwas dabei und auch fast von A - Z :-P\nJeder der sich denkt: I LIKE BIG BOOST ist hier genau richtig, frei nach dem Motto FÄHRSTE QUER SIEHSTE MEHR siehst du hier Aufnahmen von Drifts, Drags und anderen Spielerein die große Jungs halt gerne machen.\n\nWenn du Anregungen / Wünsche oder sonstiges hast, kannst du dich gerne melden unter:\n0231/39696375 - info@jp-performance.de - www.jp-performance.de",Saarland,49.25039044,6.970003213,POINT (6.970003213 49.25039044)
mmMPprcmJeA,17.14.11,Diese Schlafposition solltest Du unbedingt vermeiden! | Liebscher & Bracht,Liebscher & Bracht | Die Schmerzspezialisten,17,2017-11-12T09:00:05.000Z,"Liebscher|""Bracht""|""Faszien""|""LNB""|""Schmerztherapie""|""Übung""|""Roland""|""Liebscher-Bracht""|""Schmerzspezialisten""|""schlafen rückenschmerzen""|""rückenschmerzen beim schlafen""|""richtige schlafposition""|""rückenschmerzen schlafen""",109571,4357,303,357,https://i.ytimg.com/vi/mmMPprcmJeA/default.jpg,False,False,False,"Weitere Infos zu diesem Thema findest du hier:\nhttps://www.liebscher-bracht.com/diese-schlafposition-vermeiden/\n\nJeder Mensch schläft etwa sieben bis neun Stunden pro Tag. Doch was viele nicht wissen: Durch eine dauerhaft falsche Schlafposition können wir unserem Körper enorm schaden!\nSchmerzspezialist Roland Liebscher-Bracht zeigt Dir in diesem Video, wie Du das verhindern kannst.\n\nEuch hat das Video gefallen? Dann TEILT es bei WhatsApp, Facebook und Co. und ABONNIERT unseren Kanal ► https://bit.ly/2bL0FCS ◄\n\nDas neue Buch vom Schmerzspezialisten Roland Liebscher-Bracht:\n❌ Die Arthrose-Lüge❌ Jetzt bestellen: ➡️  http://amzn.to/2wRPmof \n\n❇️ Unser Online-Schmerzcoach - 7 Tage GRATIS testen ►https://www.online-schmerzcoach.de◄\n\n❇️ Faszien-Rollmassage Set bestellen \n► hhttps://www.liebscher-bracht.com/Faszien-Rollmassage-Set ◄\n\n❇️ Mehr Tipps auch hier \n►https://www.fb.me/schmerzspezialisten ◄\n\n\n❇️  Mehr Informationen über die Liebscher & Bracht Schmerztherapie findest Du auf ►►► https://www.liebscher-bracht.com/ausbildung-schmerztherapie/\n------------------------------\nDu leidest an akuten Schmerzen? Hier finden Du einen Liebscher & Bracht-Therapeuten in Deiner Nähe ►►►https://www.liebscher-bracht.com/schmerztherapeuten-finden/\n\n------------------------------\nDu bist Therapeut und interessierst Dich für eine Ausbildung zum Schmerztherapeuten nach Liebscher & Bracht? \n\nHier kannst Du kostenfrei & unverbindlich unsere Ausbildungs-Info-Unterlagen anfordern. ►►►https://www.liebscher-bracht.com/ausbildung-schmerztherapie\n------------------------------\nFolge uns auf unseren weiteren Online-Kanälen:\n\nFacebook: http://facebook.com/schmerzspezialisten\nInstagram: http://instagram.com/liebscher.bracht\nYouTube: https://www.liebscher-bracht.com/DieSchmerzspezialisten\nWebsite: http://www.liebscher-bracht.com",Thuringen,50.97005292,11.02996212,POINT (11.02996212 50.97005292)
3U51cVIqulM,17.14.11,ARAB Lifestyle | mit Bodyformus,PlanetKanax,23,2017-11-13T11:59:43.000Z,"planetkanax|""planet""|""kanax""|""planet kanax""|""arab""|""bodyformus""|""barry""|""arabs""|""arab lifestyle""|""lifestyle""|""araber""|""araber life""|""leben eines araber""|""wetten""|""shisha""|""shisha rauchen""|""eier geschmack""|""brot tabak""|""tabak""|""comedy""|""komödie""",99988,6397,298,429,https://i.ytimg.com/vi/3U51cVIqulM/default.jpg,False,False,False,"Video mit Bodyformus: https://youtu.be/EIM7RMe39JY\n\nBusiness-Kontakt: planetkanax@gmail.com\n\nFolgt uns auf INSTAGRAM:\n@planetkanax\n\n@bodyformus\n@ben.mood\n@asyadreaming\n@nelson.depayze\n\nYouTube:\nBEN MOOD: https://www.youtube.com/channel/UC8dq-Qk1rOMMAci5A4g4Xcg\n\nNELSON DEPAYZE: https://www.youtube.com/channel/UCbs9Wm1qAIIstKhUOzjkuyQ\n\nHey Leute,\nHerzlich Willkomen auf unser Comedy Kanal PlanetKanax.\nViel Spaß mit unseren Videos.\nFreuen uns über jeden Like und Abo✌️\nSchöne Grüße vom PlanetKanax-Team.",Mecklenburg Vorpommern,53.63330408,11.41669861,POINT (11.41669861 53.63330408)
OKYUtHvgMhc,17.14.11,Die Welt in 30 Jahren - Sommer 2047 -  VOLKAN,VOLKAN,24,2017-11-12T16:09:44.000Z,"Welt|""Natur""|""Umwelt""|""Klima""|""Klimawandel""",37877,1839,327,170,https://i.ytimg.com/vi/OKYUtHvgMhc/default.jpg,False,False,False,"Über die Zukunft nachzudenken macht Spaß, oder? \nBis du realisierst.... Es wird nicht weniger Naturkatastrophen geben, sondern mehr! Es wird nicht mehr Artenvielfalt geben, sondern weniger! Saubere Meere? Fehlanzeige. Gute Luft zum Atmen? Bald fast nirgends mehr. Leute! Wenn wir nicht endlich aufwachen, zerstören wir bald das einzige Zuhause das wir haben. \nEs gibt keinen Plan B. \n\nKamera / Edit / Colorgrading:\nSerkan Tuna http://instagram.com/bboyzerk\n\nFootage: \nNational Geographic\nLicensed under Creative Commons: By Attribution 3.0\nhttps://creativecommons.org/licenses/by/3.0/",Sachsen,50.82998395,12.91997595,POINT (12.91997595 50.82998395)
spwqQDCW4TI,17.14.11,RUNDLAUF FUßBALL CHALLENGE + BESTRAFUNG !!,Brotatos,24,2017-11-13T14:03:32.000Z,"fußball challenge|""brotatos""|""fußball""|""football""|""challenge""|""brotatos fußball challenge""|""football challenge""|""rundlauf""|""roulette""|""fußball rundlauf""|""fußball rundlauf challenge""|""fußball roulette""|""roulette challenge""|""bestrafung""|""fußball bestrafung""|""fußball challenge mit bestrafung""|""schneller 16er""|""schneller sechzehner""|""tor""|""fußball tor""|""bestes tor""|""extrem""|""ultimativ""|""verletzung""|""fußball verletzung""|""fußball challenge verletzung""",111328,10692,115,548,https://i.ytimg.com/vi/spwqQDCW4TI/default.jpg,False,False,False,"Die Rundlauf Fußball Challenge! Jeder kennt das Spiel :D\nJeder hat 5 Leben, wer verschießt muss ins Tor. Wer einen Ball reinlässt verliert ein Leben...\nMit dabei: \nRoadkickerz ► http://bit.ly/2qVvXyy\nStrikers ► http://bit.ly/2gGHY57\nLocofloki ► http://bit.ly/2eLhWwc\nDanke für euren Support! :) Du findest uns hier ▼\n► Instagram: http://instagram.com/brotatos\n► Twitter: https://twitter.com/BrotatoGang\n► Unser Shop!: http://shop.spreadshirt.de/Brotato-Merch/\n► 2. Kanal: http://bit.ly/1kbGYmx & http://bit.ly/2jCIcMK\n\n► Private Links ◀︎\n\nINSTAGRAM\n\n» Lucas: http://instagram.com/spideylucas \n» Lars: http://instagram.com/lars_holzi\n\nTWITTER\n\n» Lucas: https://twitter.com/spideylucas\n» Lars: https://twitter.com/lars_holzi\n\nDon't worry, be Potato",Berlin,52.52181866,13.40154862,POINT (13.40154862 52.52181866)
-MAgDuA3H9A,17.14.11,Schauriger_Geist.png - Thumbnail der Woche,Ultralativ,27,2017-11-12T13:00:00.000Z,"standartskill|""standart skill""|""standard skill""|""standart skill kritik""|""geister videos""|""geister kamera""|""geister aufnahme""|""youtube""|""youtube trends""|""youtube kritik""|""youtube deutschland""|""ultralativ""|""thumbnailanalyse""|""thumbnail lüge""|""thumbnail fail""|""TDW""|""Stand’artagnan""",93628,7924,118,308,https://i.ytimg.com/vi/-MAgDuA3H9A/default.jpg,False,False,False,"Geister gibt es überall... auf YouTube, man muss sie nur mit spontan rausgesuchten PNGs sichtbar machen!\n\n_\n\nWeitere mindestens fast so interessante Videos:\n\nThumbnail der Woche:\nhttp://goo.gl/hpSnzl\n\nUKWlativ:\nhttp://goo.gl/jHDERu\n\nHow to Assi-Thumbnails:\nhttp://goo.gl/hRPTvj\n\nYouTube kann halt doch was:\nhttps://goo.gl/7fTsXc\n\nF.A.M.E. Review:\nhttps://goo.gl/bRJPD3\n\nDie Schattenseite der Trends:\nhttps://goo.gl/gR9oWz\n\n_\n\nSocial Media:\nTwitter\nhttps://goo.gl/Ixl5Ns\n\nSoundcloud\nhttps://goo.gl/TdySK3\n\nFanFiktion\nhttp://goo.gl/eiEgwQ\n\nMySpace\nhttp://goo.gl/quMpdn\n\n_\nQuellen:\nhttp://mitchmartinez.com/free-4k-red-epic-stock-footage/\nMusik:\nDowntown Jump - Terry Devine-King",Bremen,53.55043805,8.579982461,POINT (8.579982461 53.55043805)
riV8xuBqUQ0,17.14.11,Duell der Giganten 2.0 | inscopelifestyle,InscopeLifestyle,22,2017-11-12T16:34:53.000Z,"inscopelifestyle|""VLOG""|""CarVlog""|""lamborghini""|""lamborghini aventador""|""aventador""|""e63""|""e63 amg""|""amg""|""mercedes""|""mercedes benz""|""need for speed""|""nfs""|""need for speed payback""|""carporn""|""mustang""|""ford mustang""|""race""|""0-100""|""unsympathischtv""|""shpendiboy""|""einfachpeter""|""ferrari""|""ferrari california""|""race track""|""flugplatz""|""duell der giganten""|""fast and the furious""|""street race""|""straßen rennen""",113961,8891,260,1385,https://i.ytimg.com/vi/riV8xuBqUQ0/default.jpg,False,False,False,"Ihr wolltet ein zweites Duell der Giganten, ihr kriegt ein zweites Duell der Giganten. Genießt das Video und lasst einen Daumen hoch da. Und wenn ihr dann immer noch nicht genug habt, nehmt am Gewinnspiel teil!\n \n(P) Dieses Video wird unterstützt durch Produktplatzierung\nDankeschön an EA und Need for Speed für die Möglichkeit dieses Video zu drehen.\n►Checkt die Webseite für mehr Infos: http://www.needforspeed.de/\n \nGewinnspiel-Infos:\nZu gewinnen gibt drei Mal das signierte PS4 Spiel Need for Speed: Paypack und dazu jeweils ein T-Shirt. Der Gewinner wird durch das Zufallsprinzip aus den Kommentaren unter diesem Video ausgewählt. Der Rechtsweg ist ausgeschlossen. Das Gewinnspiel endet am Sonntag, den 19.11.2017 um 23:59 Uhr. Die vollständigen Teilnahmebedingungen finden sich hier: http://bit.ly/2hpxTt3\n\nhier gehts zu den Jungs:\n\nSascha: https://www.youtube.com/user/unsympathischtv\nShpendi: https://www.youtube.com/channel/UCm32Mjdv3OhNrDT-RXExViA\nPeter: https://www.youtube.com/channel/UCvZxLLwvrXrRf1mENhqJKkw",Niedersachsen,53.1299986,8.220004434,POINT (8.220004434 53.1299986)
