video_id,trending_date,title,channel_title,category_id,publish_time,tags,views,likes,dislikes,comment_count,thumbnail_link,comments_disabled,ratings_disabled,video_error_or_removed,description,state,lat,lon,geometry
v5_27anzZwY,17.14.11,Fazilet Hanım ve Kızları 22. Bölüm,Fazilet Hanım ve Kızları,22,2017-11-11T21:07:02.000Z,"fazilet hanım ve kızları|""fazilet hanım izle""|""star tv""|""yerli hd dizi izle""|""fazilet hanım ve kızları oyuncuları""|""fazilet hanım son""|""fazilet hanım hazan""|""fazilet hanım ece""|""egemen yalısı""|""avşar film""|""fhvktam""",935983,6553,720,1267,https://i.ytimg.com/vi/v5_27anzZwY/default.jpg,False,False,False,"Bu dizi ve çok daha fazlası puhutv'de → https://puhutv.com/fazilet-hanim-ve-kizlari-detay?utm_medium=referral&utm_source=youtube&utm_campaign=fazilet_hanim_ve_kizlari&utm_content=detay\n\nFazilet Hanım ve Kızları'na Abone Olmak İçin → http://bit.ly/fhvk-dd-sub\n\nFazilet Hanım ve Kızları 22. Bölüm Özet:\n\nHazan’ın Yağız’a komşu olması, Yağız ve Sinan için altından kalkması kolay olmayan bir şoka dönüşürken, abi kardeş arasındaki gerilim hiç olmadığı kadar yükselir. \nHazan, Sinan’ın canını yakmak için hiçbir fırsatı kaçırmazken, Yağız için Hazan’ın yanı başında olmasıyla yeni bir duygusal sınav başlamıştır. \nYalıdan kovulan Fazilet, ne yapacağını bilemez halde, kızından umudunu kesmeden masumiyetini kanıtlamaya çalışsa da Yasemin, yalıda savunmasız kalmış olan Ece’yi avucunun içine almak için yeni hesaplar peşindedir. \nFazilet’in Ece’den yediği darbeler bitmek bilmezken, Yasemin’in tuzağına düşen Ece geri dönüşü olmayan bir yola girmek üzeredir. \nHazan annesinin başına gelenlerden habersiz, kendi intikam oyununda acı ve öfkeyle sınanırken, Sinan için kıskançlığı, Yağız için de çırpındığı çaresiz aşkı saklamak artık imkansızdır.\n\nYapım: Avşar Film\nSenaryo: Sırma Yanık\nYönetmen: Gökçen Usta\n\nOyuncu Kadrosu:\nFazilet Çamkıran: Nazan Kesal\nHazan Çamkıran: Deniz Baysal\nEce Çamkıran: Afra Saraçoğlu\nHazım Egemen: Mahir Günşırak\nGüzide Egemen: Gülsen Tuncer\nYağız Egemen: Çağlar Ertuğrul\nSinan Egemen: Alp Navruz\nGökhan Egemen: Tolga Güleç",Bayern,50.26660748,10.96660681,POINT (10.96660681 50.26660748)
ldOa-2m6bQc,17.14.11,"Mikrometer, um 1900 - Bares für Rares vom 13.11.2017 | ZDF",ZDF,24,2017-11-13T12:30:00.000Z,"ZDF|""Bares für Rares""|""Horst Lichter""|""Antik""|""Mikrometer""|""Messgerät""|""1900""|""Industrie""|""Louis Schopper""|""Rarität""|""Messing""",5853,26,4,16,https://i.ytimg.com/vi/ldOa-2m6bQc/default.jpg,False,False,False,"Mehr Bares für Rares: http://ly.zdf.de/crV/\n\nJosef Biber möchte ein Erbstück schätzen lassen: Ein antikes Messgerät, ein Mikrometer, etwa um 1900 datiert.\nLaut Aufdruck handelt es sich um ein Automatic Micrometer Nr. 3895, das von der Firma Louis Schopper in Leipzig in der Zeit um 1900 hergestellt wurde. Ein Mikrometer kann als Stärken- oder Dickenmesser verwendet werden.\nDas Gerät ist zwar optisch nicht mehr ganz so schön und auch die Feinjustierung ist nicht mehr ganz genau, aber trotzdem handelt es sich um ein interessantes, antikes und noch funktionstüchtiges Messgerät.",Mecklenburg Vorpommern,53.63330408,11.41669861,POINT (11.41669861 53.63330408)
kUFB_AseTl0,17.14.11,Das war knapp?! Ostdeutsche Meisterschaft! #Oldschooldiet VLOG 14.1,Johannes Luckas - Personal Training,17,2017-11-13T16:00:07.000Z,"Johannes Luckas|""Bodybuilding""|""Fitness""|""Kraftsport""|""Personaltrainer""|""Coaching""|""Ostdeutsche Meisterschaft 2017""|""Ostdeutsche Meisterschaft""|""Bodybuilding Meisterschaft""|""Sieg auf der Ostdeutschen Meisterschaft""|""knappe Ergebnis""|""Oldschooldiet""|""VLOG""",36875,3831,34,419,https://i.ytimg.com/vi/kUFB_AseTl0/default.jpg,False,False,False,"Habe ich umsonst gezweifelt? Erneut der Sieg auf der Ostdeutschen Meisterschaft im Bodybuilding? Schaut euch das knappe Ergebnis an! \n-------------------------------------------------------------------\nLINK zum EBOOK & Oldschooldiet PAKET:\n►►►https://oldschooldiet.de\n-------------------------------------------------------------------\nMehr Videos zum Thema Bodybuilding, Fitness & Kraftsport findet Ihr in meinem Kanal - Abo ►►► http://goo.gl/IuqdXF\n-----------------------------------------------------------------------------------------------------------------\n\nMeine Nahrungsergänzungen & Supps ►►► https://goo.gl/pEH8hr\nSPARE 15% auf ALLES mit RABATTCODE - johannes15\n-----------------------------------------------------------------------------------------------------------------GEHEIM TIPP - Fischöl ►►► https://goo.gl/gcEZEK\nMein Wheyprotein ►►► https://goo.gl/dEYpyF\nLieblingsriegel ►►► https://goo.gl/3pvv7f\nMein CREATIN ►►► https://goo.gl/a7DzoE\nMein GLUTAMIN ►►► https://goo.gl/z6KYe6\nPUMP BOOSTER vor dem TRAINING ►►► https://goo.gl/kvDGBg\nBooster EXTREM  ►►► https://goo.gl/wmk2Js\n-----------------------------------------------------------------------------------------------------------------\nMeine Funktions Hosen ►►► http://amzn.to/2k7WGBp ✔\nVitamin D ►►► http://amzn.to/2lPpwIp ✔\nSpezial Vitamin D Öl mit K2 ►►► http://amzn.to/2yTFPKT ✔\nMagnesium Spezial ►►► http://amzn.to/2s12rsz ✔ \nMagnesium günstig ►►► http://amzn.to/2guhc2E✔\n5 HTP (Schlafqualität) ►►► http://amzn.to/2lPthxH ✔\nGABA (Schlafqualität) ►►► http://amzn.to/2xqIWwb ✔\n\nSpezial BAD für Regeneration ►►► http://amzn.to/2vwEJGI ✔\n----------------------------------------------------------------------------------------------------------------\n\nMeine ONLINE Tests (10 % Rabatt mit CODE - JOHANNES10)\n ►►►https://www.cerascreen.de\n\nMein Puls und HRV-Messgerät für bessere Leistung (Bio-Hacking)\n►►► http://goo.gl/MqVeYb\n\nMein Video-Equipment:\nPremium Cam für beste Bilder ►►► http://amzn.to/2rnY9e2 ✔\nVlogging Cam ►►► http://amzn.to/2qEwrbO✔\nProfi Microfon ►►► http://amzn.to/2r2ocYt ✔\n\nPersonaltraining & Business ►►► http://goo.gl/I20D7B\n \nMeine T-Shirts ►►► http://goo.gl/2vgWzI\n \nFacebook ►►► http://goo.gl/y9sWri\nInstagram ►►► http://goo.gl/Mc5glD\n   \nMeine Superfoods hier ►►► http://goo.gl/oJlvP3\n(5% Rabatt bei Koro mit Rabatt Code = johannes)\n \nMeine Lebensmittel von Fittaste ►►► http://goo.gl/VR8zLS\n(10% Rabatt mit Rabatt Code = johannes10)\n\n► Amazon Affiliate Links: Mit ✔ markierte Links sind sogenannte Affiliate-Links. Durch einen Einkauf über diese Links werde ich mit einer Provision beteiligt. Für Euch entstehen dabei selbstverständlich keine Mehrkosten! Danke für Eure Unterstützung!",Niedersachsen,53.1299986,8.220004434,POINT (8.220004434 53.1299986)
Zo9CSpCLPVc,17.14.11,Kojshia Show - Emisioni 124 (Sez 2017) 11.11.2017,Radiotelevision 21 [ Official Channel ],24,2017-11-12T21:01:46.000Z,"RTV21|""Kojshia Show""|""Iva Aliko""",178906,155,76,40,https://i.ytimg.com/vi/Zo9CSpCLPVc/default.jpg,False,False,False,"Ne studio: Iva Aliko, Hysen Rudi",Mecklenburg Vorpommern,53.63330408,11.41669861,POINT (11.41669861 53.63330408)
YGA-zEWGAQ0,17.14.11,Lege eine Zitrone mit Salz auf einen Teller und schau was passiert!,Gesundheitsblatt,26,2017-11-13T17:00:04.000Z,"gesundheitsblatt|""gesund""|""tipps""|""tricks""|""die 5""|""die 10""|""natürliche heilmittel""|""essen""|""abnehmen""|""charts""|""wissen""|""beauty""|""lifestyle""|""zitrone""|""salz""|""teller""|""unglaublich""|""wirkung""|""gesundheit""",15737,730,114,56,https://i.ytimg.com/vi/YGA-zEWGAQ0/default.jpg,False,False,False,"Lege eine Zitrone mit Salz auf einen Teller und schau was passiert\n\nBei Fragen rund um das Video wende dich bitte an: gesundheitsblatt@outlook.com\n\nJetzt kostenlos ABONNIEREN ► https://goo.gl/TcYM8Z\n\nGesundheitsblatt auf Facebook: https://facebook.com/gesundheitsbl\nGesundheitsblatt auf Twitter: https://twitter.com/gesundheitsbl\nGesundheitsblatt auf Instagram: https://instagram.com/gesundheitsbl\n\n[Hinweis]\nEinige Bilder und Videos unterliegen \nder Creative Commons CC0: https://creativecommons.org/publicdomain/zero/1.0/\nder Creative Commons Attribution 2.0: https://creativecommons.org/licenses/by/2.0/de/\nder Creative Commons Attribution-ShareAlike 2.5: https://creativecommons.org/licenses/by-sa/2.5/\noder der Commons Attribution 3.0: https://creativecommons.org/licenses/by/3.0/de/\n\nQuellen:\nShutterstock, Wikimedia, Pixabay und mehr",Sachsen Anhalt,52.13042137,11.62000362,POINT (11.62000362 52.13042137)
LuQI2BLhCCI,17.14.11,بث مباشر مباراة العراق و سوريا 2017/11/13,Hussein Al Iraqi,23,2017-11-13T17:34:43.000Z,"مباراة العراق و سوريا|""بث مباشر مباراة العراق و سوريا""|""مشاهدة مباراة العراق وسوريا بث مباشر بتاريخ 13-11-2017 مباراة ودية""|""قناة العراقية الرياضية بث مباشر""|""بث مباشر مباراة العراق و سوريا 2017/11/13""|""العراق وسوريا بث مباشر""",105138,1693,97,29,https://i.ytimg.com/vi/LuQI2BLhCCI/default.jpg,False,False,False,لاتنسى الاشتراك في القناة \nالهدف الاول لسوريا\nhttps://www.youtube.com/watch?v=U6-Ac0wgMlk\nالهدف الاول للعراق \nhttps://www.youtube.com/watch?v=40kIMA3fkmc\nالنشيد الوطني العراقي و السوري\nhttps://www.youtube.com/watch?v=B7fh5BLjNqo,Baden Wurttemberg,48.99999229,8.399993448,POINT (8.399993448 48.99999229)
oZL3hWtWHGA,17.14.11,Ben treibt Krumme Geschäfte? 🤦😲 | Köln 50667,Köln 50667 - QuitRndm,22,2017-11-13T17:42:46.000Z,"Köln50667|""köln50667""|""btn""|""BTN""|""'Berlin""|""Tag""|""und""|""Nacht'""|""'berlin""|""tag""|""nacht'""|""'Köln""|""50667'""|""'köln""|""milla""|""caro""|""leon""|""rtl2""|""teenwolf""|""'die""|""simpsons'""|""deutsch""|""hd""|""staffel""|""Ben treibt Krumme Geschäfte? | Köln 50667""",24103,238,6,4,https://i.ytimg.com/vi/oZL3hWtWHGA/default.jpg,False,False,False,Ben treibt Krumme Geschäfte?\n\n\nAlle Rechte gehen an RTL2 und Filmpool!\n\n\nBen treibt Krumme Geschäfte? | Köln 50667\n*****\nExtra Tags:\nKöln50667\nKöln 50667,Saarland,49.25039044,6.970003213,POINT (6.970003213 49.25039044)
U271g04LDVo,17.14.11,FIFA 18: EXTREME TEAM ROTATE CHALLENGE 😱😱,proownez,20,2017-11-13T18:17:09.000Z,"fifa 18|""squad builder""|""weekend league""|""challenge""|""team""|""squad""|""rotate""|""gameplay""|""lets play""|""commentary""|""facecam""|""proownez""|""skill""|""tricks""|""deutsch""|""german""",94891,7741,131,478,https://i.ytimg.com/vi/U271g04LDVo/default.jpg,False,False,False,"FIFA 18: EXTREME TEAM ROTATE CHALLENGE!! STÜRMER ALS KEEPER, MANAGER IM MITTELFELD & POSITION CHANGES!!\n👉FIFA 18 COINS mit BESTEM SERVICE und GUTEN PREISEN bei igvault (6% RABATTCODE: proownez): https://goo.gl/ySpbYT\n👉GÜNSTIGE GAMEKEYS, PSN & XBOX CARDS & mehr bei MMOGA (MEGA RABATTCODE: proownez): http://goo.gl/TAWnSX\n⛔️FIFA 18 JETZT BEI AMAZON BESTELLEN UND ULTIMATE TEAM, KARRIERE & MEHR ZOCkEN: http://amzn.to/2sPs4ch\n\nFalls ihr euch zum Release von FIFA 18 noch FIFA POINTS gönnen wollt dann kauft diese gerne bei meinem SPONSOR MMOGA und erhaltet die Codes innerhalb von 5 Minuten per Mail: http://www.proownez.de/mmoga (mit jedem Kauf über meinen Link supportet ihr mich und durch den Code proownez spart ihr Geld!)\n\nZu mmoga (Rabattcode proownez):\n👉http://www.proownez.de/mmoga\n👉http://www.proownez.de/mmoga\n👉http://www.proownez.de/mmoga\n\nMEIN MERCHANDISE\n👉Meine Merchandise Klamotten kann man sich bei tumilo kaufen! Hier geht es zu meinem Shop: https://goo.gl/SRUzO4\n👉Falls ihr Bock auf meine eigenen Controller habt, könnt ihr euch diese hier kaufen: https://goo.gl/J2BD02 (Code: Proownez)\n\nMEINE SOCIAL MEDIA KANÄLE\n👉Mein Facebook: http://goo.gl/cRGWJ6\n👉Mein Instagram: http://goo.gl/J8DtXg\n👉Mein Twitter: https://goo.gl/cXjTBM\n👉Mein Twitch: https://goo.gl/T47Eev\n👉Business Mail: proownez@tumilo.com\n\n►Meine Ausrüstung:\n✘Beste Gamingstühle: http://goo.gl/Ki0Z7C\n• Unterstützt mich über Amazon: http://goo.gl/Ntc3R6\n✘Bester PC Monitor: http://amzn.to/2alf7n1\n✘Beste Tastatur: http://amzn.to/2alf3Uf\n✘Beste Maus: http://amzn.to/2aAPJIw\n✘Bester Laptop: http://amzn.to/2alfbDg\n✘Beste Webcam: http://amzn.to/2aAPmNR\n✘Bestes Headset: http://amzn.to/2aAPD3m\n✘Bester Greenscreen: http://amzn.to/1vYPMyv\n✘Beste externe Festplatte: http://amzn.to/2alfQ7z\n✘Bester Kamera: http://amzn.to/2aleQR3\n✘Bestes Handy: http://amzn.to/2alfez5\n✘Bestes Spiel: http://amzn.to/2alf9v4\n✘Bestes Mikro: http://amzn.to/2alf5vs\n\nFür geile Beats hier vorbeischauen: \n• http://goo.gl/HqSC6J\n• http://goo.gl/A6BHrb\n• http://goo.gl/06jxyy",Bremen,53.55043805,8.579982461,POINT (8.579982461 53.55043805)
wE679w4XF1s,17.14.11,Pimp my Playmobil - Familie Hauser bastelt Gemüse - Kinderfilm Special,Familie Hauser - Family Stories,1,2017-11-12T08:30:00.000Z,"Playmobil|""Playmobil Film deutsch""|""Familie Hauser""|""Kinder""|""Spielzeug""|""Basteln""|""Special""",99356,3250,132,290,https://i.ytimg.com/vi/wE679w4XF1s/default.jpg,False,False,False,PLAYMOBIL Familie Hauser bastelt Gemüse. Pimp my PLAYMOBIL Special. Viel Spaß! #familiehauser\nKinder Spielzeug - Film\nKostenloses Kanalabo: http://bit.ly/1UbYqrg\nLetztes Video: https://youtu.be/SOwmwaz4wTA\nInstagram: https://www.instagram.com/familie_hauser/\nFacebook: https://www.facebook.com/FamilieHauser/\n\nAuf unserem Kinderkanal Family Stories seht ihr tolle Kinderfilme.\n\nAlle Videos unserer Serie hier:\nStaffel 1: https://www.youtube.com/playlist?list=PLXpVKmTOEL8HAZkwGT7i8_gPKkZXt0sYC\nStaffel 2: https://www.youtube.com/playlist?list=PLXpVKmTOEL8G_5GOffAYrJy4qHZEP6Yud\nStaffel 3: https://www.youtube.com/playlist?list=PLXpVKmTOEL8E0T0fMqs_W1VbVWhhZPabq\nStaffel 4: https://www.youtube.com/playlist?list=PLXpVKmTOEL8EJQ_l1MCjVRM4TFM0634rn\nStaffel 5: https://www.youtube.com/playlist?list=PLXpVKmTOEL8Gs5KrJ83VMjIIKToR_iuVf\nStaffel 6: https://www.youtube.com/playlist?list=PLXpVKmTOEL8EaicQUr6oUIlAT8V8AiqU7\nStaffel 7: https://www.youtube.com/playlist?list=PLXpVKmTOEL8HIPwSrpWPLBzPU9iJnDVxT\nStaffel 8: https://www.youtube.com/playlist?list=PLXpVKmTOEL8Esooxy47OrseeOze_lBi3Q\n\nAlle Geschichten von Lena und Anna Hauser findet ihr hier: https://www.youtube.com/playlist?list=PLXpVKmTOEL8HeLGX4vRtpBo0lu_RDWgYN\nAlle Kindergeschichten mit den Zwillingen Paul und Alex und ihren Eltern: https://www.youtube.com/playlist?list=PLXpVKmTOEL8HqyESnwbMC8xdXk_wnqDvE\n\nAußerdem auf unserem Kinderkanal: Pimp my PLAYMOBIL. Die Kinderserie mit tollen Tipps zum Verschönern eurer PLAYMOBIL-Welt:\nhttps://www.youtube.com/playlist?list=PLXpVKmTOEL8E2aeB0HdK1SP2AU1_8aGxG\n\nSpannende Fälle von PLAMOBIL-Kommisar Overbeck mit der PLAYMOBIL Polizei: https://www.youtube.com/playlist?list=PLXpVKmTOEL8GybWnHdJZqYCPMXO1ATULv\nUnd hier alle Specials zu unserem Kinderkanal Family Stories: https://www.youtube.com/playlist?list=PLXpVKmTOEL8HLEHHAwW-iaxtAZlhx3CAo\nAlle unsere PLAYMOBIL - Western Filme gibt es hier: https://www.youtube.com/playlist?list=PLXpVKmTOEL8GpsvwZCNCLqACr3KIu3vDY\nSingt mit Familie Hauser: https://www.youtube.com/playlist?list=PLXpVKmTOEL8Hq1USxFANBidw3VNFYPi8y\nAlle Filme mit der PLAYMOBIL Kita Sonnenschein: https://www.youtube.com/playlist?list=PLXpVKmTOEL8EXqoji7tY5J5BTr7yludBG\nFamilie Hauser in den Ferien: https://www.youtube.com/playlist?list=PLXpVKmTOEL8EazbeGb2TpYgI9DlQEqSKe\n\nHier geht es zu unserem Instagram: https://www.instagram.com/familie_hauser/,Schleswig Holstein,54.78374778,9.433315388,POINT (9.433315388 54.78374778)
TDn28TahPA8,17.14.11,Versuche NICHT AWW zu SAGEN bei diesem VIDEO!! (MEGA süße Tiere - UNMÖGLICH!),El Margo,24,2017-11-11T12:43:46.000Z,"Versuche nicht Aww zu sagen bei diesem Video mega süße Tiere unmöglich|""Versuche nicht Aww zu sagen""|""Versuche nicht Aww zu sagen bei diesem Video""|""Versuche nicht Aww zu sagen Challenge""|""Wer Aww sagt hat verloren""|""Wer Aww sagt verliert""|""süße Tiere""|""Aww""|""nicht aww sagen""|""Tiere""|""süß""|""niedliche Tiere""|""Challenge""|""Try not to say Aww""|""Try not to say Aww Challenge""|""El Margo""|""elmargo""|""Reaktion""|""family friendly""|""familienfreundlich""|""for kids""|""für Kinder""|""Unterhaltung""|""Spaß""|""lachen""|""lustig""|""witzig""",145694,8403,1595,2304,https://i.ytimg.com/vi/TDn28TahPA8/default.jpg,False,False,False,"Versuche nicht Aww zu sagen bei diesem Video! (mega süße Tiere - unmöglich) ☆ Versuche nicht Aww zu sagen Challenge ☆ Wer Aww sagt hat verloren ☆  Try not to say Aww Challenge\n\n► Meine WUNSCHLISTE an dich:\n\n1. Du abonnierst mich :-)\n2. Du gibst einen Daumen hoch :-)\n3. Du schreibst einen lieben Kommentar :-)\n4. Du folgst mir auf Instagram und Twitter usw. :-)\n____________________________\n\n► FOLGE mir auf:\n\n✘ Instagram: https://tinyurl.com/insta-margo\n✘ Twitter: https://twitter.com/ElMargoTV\n✘ Snapchat: http://tinyurl.com/snap-margo\n✘ Facebook: https://www.facebook.com/ElMargo\n✘ Musical.ly: https://tinyurl.com/music-margo\n✘ Twitch: https://www.twitch.tv/elmargotv\n____________________________\n\n► Geschäftliche Anfragen: matsgmbh@gmail.com\n____________________________\n\nIhr seid die Besten, DANKE! :-)\n____________________________\n\nQuellen der Musik und Videoinhalte:\n- https://youtu.be/oQMibs2Xkrw\n- https://youtu.be/dPVgWjuEu8c\n- https://youtu.be/eOhWxBpc7Zs\n- https://youtu.be/m18Y2wBENCw",Brandenburg,51.7704175,14.32996741,POINT (14.32996741 51.7704175)
7qiOrNao9fg,17.14.11,Google Translate Interview w/ Craig Robinson,Good Mythical Morning,24,2017-11-13T11:00:01.000Z,"rhett and link|""gmm""|""good mythical morning""|""rhett and link good mythical morning""|""good mythical morning rhett and link""|""mythical morning""|""Season 12""|""rhett""|""link""|""mythical""|""mythical show""|""craig robinson""|""google translate""|""craig robinson ghosted""|""craig robinson interview""|""craig robinson the office""|""google""|""translate""|""interview""|""google translate sings""|""comedy sketches""|""comedy""|""funny""|""google translate interview""|""craig robinson knocked up""|""craig robinson piano""|""craig robinson vegan""",269764,8850,264,678,https://i.ytimg.com/vi/7qiOrNao9fg/default.jpg,False,False,False,Can we still chat with Ghosted's Craig Robinson after putting our interview questions through Google Translate? GMM #1218\nDon't miss an all new Ear Biscuits: https://goo.gl/xeZNQt\nWatch Part 3: https://youtu.be/puqaWrEC7tY | Watch Part 1: https://youtu.be/0ehfyX73jy8\nWatch today's episode from the start: http://bit.ly/GMM1218\n\nPick up all of the official GMM merch only at https://mythical.store\n\nFollow Rhett & Link: \nInstagram: https://instagram.com/rhettandlink\nFacebook: https://facebook.com/rhettandlink\nTwitter: https://twitter.com/rhettandlink\nTumblr: https://rhettandlink.tumblr.com\nSnapchat: @realrhettlink\nWebsite: https://mythical.co/\n\nCheck Out Our Other Mythical Channels:\nGood Mythical MORE: https://youtube.com/goodmythicalmore\nRhett & Link: https://youtube.com/rhettandlink\nThis Is Mythical: https://youtube.com/thisismythical\nEar Biscuits: https://applepodcasts.com/earbiscuits\n\nWant to send us something? https://mythical.co/contact\nHave you made a Wheel of Mythicality intro video? Submit it here: https://bit.ly/GMMWheelIntro\n\nIntro Animation by Digital Twigs: https://www.digitaltwigs.com\nIntro & Outro Music by Jeff Zeigler & Sarah Schimeneck https://www.jeffzeigler.com\nWheel of Mythicality theme: https://www.royaltyfreemusiclibrary.com/\nAll Supplemental Music fromOpus 1 Music: https://opus1.sourceaudio.com/\nWe use ‘The Mouse’ by Blue Microphones https://www.bluemic.com/mouse/,Bremen,53.55043805,8.579982461,POINT (8.579982461 53.55043805)
T89nYASkYI4,17.14.11,"Portokalli, 12 Nentor 2017 - Nasi dhe Fotinia (Humbja ne qendren tregetare)",Top Channel Albania,23,2017-11-13T13:33:26.000Z,"Portokalli|""Comedy Show""|""Top Channel Albania""|""12 Nentor 2017""|""Nasi dhe Fotinia""|""Humbja ne qendren tregetare""",55547,376,20,16,https://i.ytimg.com/vi/T89nYASkYI4/default.jpg,False,False,False,http://top-channel.tv/programe/portokalli/,Schleswig Holstein,54.78374778,9.433315388,POINT (9.433315388 54.78374778)
SxHThLAyICc,17.14.11,Michael Schumacher: Dramatisches Statement von seiner Frau!,Vinist News,24,2017-11-12T18:25:53.000Z,"Michael Schumacher|""Dramatisches Statement von seiner Frau""|""nachrichten""|""TAG24""|""deutschland""|""nachrichten online""|""nachrichten deutschland""|""vinist news""",18681,29,420,21,https://i.ytimg.com/vi/SxHThLAyICc/default.jpg,False,False,False,"Das Schicksal, das Michael Schumacher vor fast vier Jahren ereilt hat, ist einfach nur furchtbar! Seit seinem dramatischen Skiunfall ist source : http://intouch.wunderweib.de/michael-schumacher-dramatisches-statement-von-seiner-frau-76458.html",Rheinland Pfalz,49.98247246,8.273219156,POINT (8.273219156 49.98247246)
vv0XKGWVBKo,17.14.11,บ่วงบรรจถรณ์ BuangBunjathorn EP.5 ตอนที่ 3/9 | 13-11-60 | Ch3Thailand,Ch3Thailand,24,2017-11-13T17:00:07.000Z,"บ่วงบรรจถรณ์|""BuangBunjathorn""|""มาริโอ้ เมาเร่อ""|""ใหม่ ดาวิกา""|""ปั้นจั่น ปรมะ""|""ซาร่า เล็กจ์""|""อาโป ณัฐวิญญ์""|""ปราง กัญญ์ณรัณ""|""เจสัน ยัง""|""ใหญ่ ศิระ""|""ปอ ปานเลขา""|""ดวงใจ หทัยกาญจน์""|""มี้ พิศมัย""|""และนักแสดงมากฝีมือคับคั่ง""|""Ch3Thailand""|""tv3""|""ch3""|""ละครช่อง 3""|""ช่อง 3""|""ละครเย็น""|""ละครย้อนหลัง""|""drama""|""ละคร hd""|""Lakorn TV3""|""Lakorn Thaitv3""|""Thai TV3""|""lakorn hd""",22275,104,7,15,https://i.ytimg.com/vi/vv0XKGWVBKo/default.jpg,False,False,False,"รับชมละครย้อนหลังได้ที่ www.mello.me เที่ยงคืน หรือ Youtube ช่อง Ch3Thailand หลังวันออนแอร์ 2 วันนะคะ\n\nติดตามข่าวสารและความเคลื่อนไหวก่อนใครที่นี่\nFacebook : http://www.facebook.com/ch3thailand\nInstagram : http://www.instagram.com/ch3thailand\nTwitter : http://www.twitter.com/ch3thailand\n\nนำแสดงโดย : มาริโอ้ เมาเร่อ, ใหม่ ดาวิกา, ปั้นจั่น ปรมะ, ซาร่า เล็กจ์, อาโป ณัฐวิญญ์, ปราง กัญญ์ณรัณ, เจสัน ยัง, ใหญ่ ศิระ, ปอ ปานเลขา, ดวงใจ หทัยกาญจน์, มี้ พิศมัย, และนักแสดงมากฝีมือคับคั่ง\nบทประพันธ์โดย : กีรตี ชนา\nบทโทรทัศน์โดย : ชลนภัสส์ จันทรังษี, จีนุช ณ น่าน\nกำกับการแสดงโดย : อรรถพร ธีมากร\nผลิตโดย : บริษัท บรอดคาซท์ไทย เทเลวิชั่น จำกัด\nควบคุมการผลิตโดย : อรุโณชา ภาณุพันธ์\nดูคลิปย้อนหลังได้ที่ : https://www.youtube.com/playlist?list=PL0VVVtBqsouq6E4LagDbLfxTIKOTSr0GG\n\n[เพลงประกอบละคร]\n\nรักแท้มีแค่ครั้งเดียว Ost.บ่วงบรรจถรณ์ | แหนม รณเดช | Official MV\nhttps://www.youtube.com/watch?v=HMSV9XKew0A\n\nรักชั่วนิรันดร์ Ost.บ่วงบรรจถรณ์ | แนน สาธิดา พรหมพิริยะ | Official MV\nhttps://www.youtube.com/watch?v=5uxB3jFi4ro\n\nอยู่เพื่อเธอ Ost.บ่วงบรรจถรณ์ | ปั้นจั่น ปรมะ อิ่มอโนทัย | Official MV\nhttps://www.youtube.com/watch?v=yv6GB4EPw9Y",Brandenburg,51.7704175,14.32996741,POINT (14.32996741 51.7704175)
YYOCmR5Lvbw,17.14.11,2017 Brazil Grand Prix: Race Highlights,FORMULA 1,17,2017-11-12T22:05:07.000Z,"F1|""Formula One""|""Formula 1""|""Sports""|""Sport""|""Action""|""GP""|""Grand Prix""|""Auto Racing""|""Motor Racing""|""Brazilian Grand Prix""|""2017 Brazilian Grand Prix""|""Felipe Massa""|""Sebastian Vettel""|""Lewis Hamilton""|""Interlagos""",758492,11936,160,1472,https://i.ytimg.com/vi/YYOCmR5Lvbw/default.jpg,False,False,False,"Lewis Hamilton starts from the back, Valtteri Bottas at the front, and it's Felipe Massa's final F1 race on home soil...\n\nFor more F1® videos, visit http://www.Formula1.com\n\nLike F1® on Facebook: https://www.facebook.com/Formula1/\n\nFollow F1® on Twitter: http://www.twitter.com/F1\n\nFollow F1® on Instagram: http://www.instagram.com/F1",Hamburg,53.55002464,9.999999144,POINT (9.999999144 53.55002464)
