video_id,trending_date,title,channel_title,category_id,publish_time,tags,views,likes,dislikes,comment_count,thumbnail_link,comments_disabled,ratings_disabled,video_error_or_removed,description,state,lat,lon,geometry
wJwP7MigYtc,17.14.11,The Shower Song,ApeCrime,24,2017-11-12T17:31:42.000Z,"apecrime|""showersong""|""music""|""vlog""|""los angeles""|""reise""|""unter der dusche""",254226,32405,2117,1665,https://i.ytimg.com/vi/wJwP7MigYtc/default.jpg,False,False,False,"Hey Leute, viel Spass mit unserem AXE Showersong.\nSchreibt doch mal in die Kommentare, wer von Euch unter der Dusche singt.\n \n \n(P) Unterstützt durch Produktplatzierung. Danke an AXE für die Zusammenarbeit! \nHier geht’s zum Giftpack: http://amzn.to/2i5V78C\nAXE Youtube: https://www.youtube.com/c/AXEoffiziell\n \n FREE SONG DOWNLOAD: http://bit.ly/2ySTeWZ\n \n►Beste Entscheidung: http://crimeshop.de\n►Mehr auf ApeCrimeTV: https://www.youtube.com/ApeCrimeTV\n \n✗ bringt Licht in dein Leben: http://amzn.to/2rODJY9\n✗ hiermit filmen wir: http://amzn.to/2q6MxfB\n✗ hiermit schneiden wir: http://amzn.to/2qfjVfF\n \nInstagram:\n►Cengiz: http://instagram.com/cen  \n►Jan: http://instagram.com/itsjanmeyer\n►Andre: http://instagram.com/andreschiebler\n \n✗ markierte Links sind Affiliate Links: Dabei geht ein Teil des Erlöses als Provision an mich. Für euch entstehen KEINE Mehrkosten",Mecklenburg Vorpommern,53.63330408,11.41669861,POINT (11.41669861 53.63330408)
KSj3XHuABmI,17.14.11,DISNEY hat probiert IHN zu verstecken -  MILLENNIUM FALKEN in GOOGLE MAPS entdeckt/aufgetaucht!,Made My Day Movie,24,2017-11-12T13:00:03.000Z,"filmfehler|""film fehler""|""serienfehler""|""filmtheorien""|""disney""|""easter eggs""|""top easter eggs""|""star wars filmfehler""|""filmkritik""|""movie""|""trailer deutsch""|""fakten""|""filmfakten""|""filmtrailer""|""hd trailer""|""filme""",31432,1695,144,62,https://i.ytimg.com/vi/KSj3XHuABmI/default.jpg,False,False,False,"Made My Day Movie abonnieren: http://mmd.to/AboMovie\n\nUnseren kostenlosen Newsletter abonnieren: http://mademyday.com/subscribe\n\n\nAngesagte Kanäle:\nMade My Day Orange: http://mmd.to/Orange\nMade My Day: http://mmd.to/Abo\nMade My Day Music: http://mmd.to/abomusic\n\n\nSocial Media:\nMade My Day auf Facebook: http://mmd.to/facebook\nMade My Day auf Instagram: http://mmd.to/instagram\nMade My Day auf Twitter: http://mmd.to/twitter\n\n\nQuellenangaben:\n-iStock\n-Folgende Bilder und Videos unterliegen der Creative Commons Attribution 3.0: http://creativecommons.org/licenses/by/3.0/\n,der Creative Commons Attribution 2.0 https://creativecommons.org/licenses/by/2.0/ oder der Creative Commons Attribution-ShareAlike 2.5:  http://creativecommons.org/licenses/by-sa/2.5/",Schleswig Holstein,54.78374778,9.433315388,POINT (9.433315388 54.78374778)
d8JxIUGWBn8,17.14.11,Krodh | KOPS | Official Teaser | ZYRRHIX,ZYRRHIX,10,2017-11-13T07:31:08.000Z,"kops|""underground""|""rap""|""pune rappers""|""rap song""|""poet shaf""|""shaheer""|""nick jety""",54742,82,9,14,https://i.ytimg.com/vi/d8JxIUGWBn8/default.jpg,False,False,False,Zyrrhix Music Presents \n\n#Krodh \n\nFilmed by Krenature Studios \nMusic by Shaf Poet \nDirected by Santana Kumar \n\n\nFollow Us-\n\nZyrrhix Music\n\nContact  - +91 9168466796\nEmail  - zyrrhix@gmail.com\nFacebook - https://www.facebook.com/zyrrhix/\nInstagram - https://www.instagram.com/zyrrhix/\nTwitter  - https://twitter.com/zyrrhix\nSoundcloud  - https://soundcloud.com/zyrrhix\n\nKrenature Studios\n\nContact  - +91 9168466796\nEmail  - krenaturestudios@gmail.com\nFacebook - https://www.facebook.com/krenaturestudios/\nInstagram - https://www.instagram.com/krenaturestudios/\nTwitter  - https://twitter.com/krenaturestudio\nYouTube  - https://www.youtube.com/channel/UCDSwHOHledmIHkd_gywvZOw\n\nKOPS\n\nFor Bookings - +91 9168466796\nFacebook - https://www.facebook.com/officialkops/\nInstagram - https://www.instagram.com/official_kops/\nYouTube  - https://www.youtube.com/channel/UCX-QWrfDWkRIcR-Junxuvog\n\nFounder \nKHALID JAK,Sachsen,50.82998395,12.91997595,POINT (12.91997595 50.82998395)
-0ilM33s70k,17.14.11,Kleiner Gute Nacht Gruß für dich 🌙 mit lieben Grüßen von mir 💗,Elli Schramm,24,2017-11-13T17:20:47.000Z,"Grüße|""die""|""vom""|""Herzen""|""kommen""|""liebe""|""von""|""mir""|""ich""|""denke""|""an""|""dich""|""habe""|""lieb""|""Gute Abend Gute Nacht schlaf gut schlaf""|""Gute Nacht Gruß für dich""|""ich wünsche dir einen schönen Abend""|""schöne Träum""",6177,0,0,73,https://i.ytimg.com/vi/-0ilM33s70k/default.jpg,False,True,False,"Ich wünsche dir einen schönen Abend, eine gute Nacht, süße Träume und schlafe gut - ich denke an dich mit lieben Grüßen von mir🌙💗",Sachsen,50.82998395,12.91997595,POINT (12.91997595 50.82998395)
MxRlVbhMcRg,17.14.11,Yeni Gelin 24. Bölüm,Yeni Gelin,22,2017-11-11T21:16:45.000Z,"yeni gelin|""yeni gelin izle""|""show tv""|""asiye ile hazar""|""yerli dizi hd izle""|""yeni dizi""|""jessica may""|""tolga mendi""|""süreç film""|""mustafa avkıran""|""dağhan külegeç""|""möhteber""|""ersoy güler""|""ali gündoğdu""|""yeni gelin dizisi""|""yeni gelin son""|""Yeni Gelin 24. Bölüm""|""ygtam""",419325,3574,258,555,https://i.ytimg.com/vi/MxRlVbhMcRg/default.jpg,False,False,False,"Bu dizi ve çok daha fazlası puhutv'de → https://puhutv.com/yeni-gelin-detay?utm_medium=referral&utm_source=youtube&utm_campaign=yeni_gelin&utm_content=detay\n\nYeni Gelin'e Abone Olmak İçin → http://bit.ly/yg-dd-sub\n\nYeni Gelin 24. Bölüm Özet:\n\nKorkut’un herkesten sakladığı oğlu  İskender’in varlığı, konak gündemine bomba gibi düşmüştür. Kaynanalar, oğullarının ağalığı elden gidecek diye panik haldedir; gelinler, kocalarının ağalığının önündeki bu büyük engelden dolayı son derece gergindir. \n\nTüm konak, İskender meselesiyle uğraşırken yalnızca Kalender Ağa, bu meseleden uzaktır. Ağalıktan, konaktan, tüm sorumluluklarından sıyrılmıştır. Yalnızca Asude’yi düşünmektedir.\n\nKalender’in eşleri, bunu fark ettiklerinde işin vehametini anlarlar. Ve bir plan yaparlar. Bella’nın vazgeçirmeye çalışmasına rağmen kadınlar, kendilerini –Asude gibi olmak üzere- baştan yaratırlar. \nFakat kadınların her planında olduğu gibi bu planları da ayaklarına dolanır, yine kendilerini büyük bir belanın içinde bulular. Ve yine ne yapıp edip kötü yola düşmeyi ve Kalender’e cinnet geçirtmeyi başarırlar.\n\nKadınlar, hezimete uğrayınca tabi ki kabak yine, zavallı yeni gelinin başına patlamıştır. Konağı Bella’ya öylesine dar ederler ki; Bella çareyi kaçmakta bulur. Fakat Kalender’e verdikleri sözden dolayı bunu başaramaz. \n\nYeni gelin, herşeye rağmen yine mücadele edecek, yine kendi elleriyle cehennemi, cennete çevirmeye çalışacaktır. Fakat bu kez işi çok zordur.\n\nYapım: Süreç Film\nYönetmen: Ersoy Güler\nSenaryo:  Ersoy Güler\n\nOyuncu Kadrosu:\nBella: Jessica May\nHazar: Tolga Mendi\nAsiye: Yonca Şahinbaş\nKalender: Mustafa Avkıran\nKağan: Dağhan Külegeç\nMöhteber: Sema Keçik",Brandenburg,51.7704175,14.32996741,POINT (14.32996741 51.7704175)
tx6hcX7BpC4,17.14.11,"Oğlu 3 Yıl Önce Öldü, Bir Gün Bir Çocuk Kapıyı Çaldı ve Anne Benim Dedi.",Herşey Dahil,24,2017-11-13T15:32:55.000Z,"Oğlu 3 yıl önce öldü|""bir gün bir çocuk kapıyı çaldı ve""",133157,2793,209,501,https://i.ytimg.com/vi/tx6hcX7BpC4/default.jpg,False,False,False,"Oğlu 3 yıl önce öldü, bir gün bir çocuk kapıyı çaldı ve Anne benim dedi.\n\n► İzlediğiniz için teşekkürler , abone olmayı unutmayınız...\n\n► Herşey Dahil olarak size YouTube'da en bilgilendirici büyüleyici ve çekici videoları getirmeyi hedefliyoruz. Destekleriniz için teşekkürler :)\n\nSponsorluk, reklam, teklif, şikayet, soru ve görüşleriniz için bir alttaki e-posta adresine mesaj yollayabilirsiniz.\nsamettarz4@gmail.com\n\nTakip edin ;\n► Facebook Sayfamız : https://www.facebook.com/HerseyDahilHD/\n► Youtube : https://www.youtube.com/channel/UCU2G...\n► Dailymotion : http://www.dailymotion.com/HrsyDhL\n\n► Önerdiğim video : Kadınlar Hakkında 10 İlginç Tespit : https://www.youtube.com/watch?v=vjeus...\n► Japonya Hakkında 20 İlginç Bilgi : https://www.youtube.com/watch?v=fRY3d...\n► Agario Hakkında Bilmeniz Gereken 10 Bilgi : https://www.youtube.com/watch?v=TxGG6...\nBilmediklerimiz ( TÜMÜ ) : https://www.youtube.com/watch?v=wzLuj...\n\n► En Tehlikeliler ( TÜMÜ ) : https://www.youtube.com/watch?v=dmNIO...\n\n► Genelelikle kullandığım Kaynak siteler\n↓↓↓↓↓↓↓↓↓↓↓↓↓↓↓↓↓↓↓↓↓↓↓↓↓↓↓↓↓↓↓↓↓↓\n\n► line.do\n► wikipedia.org\n► future.wikia.com\n► faturetimeline.net\n► humanknowledge.net\n► preceden.com\n► youtube.com\n► onedio.com\n► newsner.com\n\n► Music : İncompetech.com",Saarland,49.25039044,6.970003213,POINT (6.970003213 49.25039044)
aq2_dEBgPeg,17.14.11,LEGO RENNWAGEN BATTLE (Oskar vs. Max) 🏎 😳,KranCrafter,24,2017-11-12T17:26:27.000Z,"lego|""lego tracked racer""|""spielzeugauto""|""rc car""|""battle""|""challenge""|""vs""|""auto fußball""|""fußball""|""rennen""|""geschicklichkeit""|""max""|""oskar""|""krancrafter""|""duell""",61222,4933,181,337,https://i.ytimg.com/vi/aq2_dEBgPeg/default.jpg,False,False,False,"Oskar und ich haben uns in drei Challenges mit dem Lego Tracked Racer gemessen!\nZu Oskar: http://youtube.com/OGGtvComedy\nAbonniert mich wenn ihr nichts mehr verpassen wollt! : http://bit.ly/JDDMPW\n\nMeine sozialen Netzwerke:\n• Instagram: http://instagram.com/maxxpane\n• Twitter: http://twitter.com/KranCrafterTV\n\nAuf meinem Kanal KranCrafter gibt es verschiedenste Videos - das können Challenges, VLogs, Gaming und vieles mehr sein - immer das, auf was ich gerade Bock habe!",Sachsen,50.82998395,12.91997595,POINT (12.91997595 50.82998395)
dqmchgH9jwg,17.14.11,EINFACH NUR UNGLAUBLICH - DIESES SPIEL MÜSST IHR EUCH ANSCHAUEN! | FIFA 18 WEEKEND LEAGUE,Mirza Jahic,20,2017-11-13T13:04:29.000Z,"fifa 18|""fut 18""|""fifa 18 ultimate team""|""tutorial""|""tipps""|""tricks""|""comeback""|""weekend league""|""fut champions""|""mirza jahic""",32873,1508,75,288,https://i.ytimg.com/vi/dqmchgH9jwg/default.jpg,False,False,False,Hier geht es zum NGU-Shop: http://www.goo.gl/FUep6e\nFIFA 18 Bestell-Link: http://amzn.to/2vYFGqI\n\nSOCIAL MEDIA:\n\nFACEBOOK: https://www.facebook.com/MirzaJahic\nINSTAGRAM: https://www.instagram.com/mirza_jahic\nTWITTER: https://www.twitter.com/mirzajahic1990\nTWITCH: https://www.twitch.tv/mirza_jahic\n\nMein Monitor: http://amzn.to/2msA7J3\n\nMeine größten Erfolge:\n\nMeister der Virtuellen Bundesliga 2014\nFünffacher Österreichischer FIFA Staatsmeister\nAktueller Weltrekordhalter in Pro Evolution Soccer\n\nBald geht es los mit spannenden Videos und Tutorials zu FIFA 18 Ultimate Team und der Weekend League!\n\nSo einen Spielverlauf wie in Spiel 29 meiner Weekend League sieht man selten. Einfach nur unglaublich!,Nordrhein Westfalen,52.02998822,8.530011351,POINT (8.530011351000001 52.02998822)
1YhtkrC2t0c,17.14.11,New Eritrean film Dama (ዳማ)  part 13 Shalom Entertainment  2017,Shalom Entertainment,22,2017-11-11T17:21:54.000Z,[none],260199,4833,302,860,https://i.ytimg.com/vi/1YhtkrC2t0c/default.jpg,False,False,False,ሰላም ነዚ ቪድዮ ካብዚ ዳዉሎድ ምግባር ን ኣርቲስ ብዙሕ ጉዳት ሲለ ዘለዎ ብክብረትኩም ካብዚ ቻነል ነዚ ቪዲዮ ዳዉሎድ ምግባር ምዝርጋሕን ኩልኩል እዩ።\n℗ © Copyright: Shalom Entertainment,Nordrhein Westfalen,52.02998822,8.530011351,POINT (8.530011351000001 52.02998822)
ITyHga-RWoE,17.14.11,Schülerin zeigt Mitschüler wegen schwarzen Humor an - Kuchen Talks #254,KuchenTV,24,2017-11-10T17:00:02.000Z,"schülerin|""klasse""|""schule""|""humor""|""unterhaltung""|""kuchen""|""talks""",349871,24873,9270,10501,https://i.ytimg.com/vi/ITyHga-RWoE/default.jpg,False,False,False,"Tora http://amzn.to/2hpZEFS\n3% Rabatt bei MMOGA: https://www.mmoga.de/KuchenTV\n10% bei INTOTHEAM Code KuchenTV: https://goo.gl/DHLE86\n\nTEAMSPEAK: kuchents.host-unlimited.de\n\nSocial Media \n► Facebook: https://goo.gl/C5baAh\n► Twitter: https://twitter.com/RealKuchenTV\n► Instagram: https://goo.gl/leZrCN\n► Twitch: http://twitch.tv/kuchngeschmack\n►Vid.me: https://vid.me/kuchentv\n\nQuellen:\nhttps://www.tz.de/welt/15-jaehrige-zeigt-mitschueler-wegen-nazi-spruechen-an-hat-konsequenzen-zr-9262938.html\nhttp://www.spiegel.de/lebenundlernen/schule/dresden-schuelerin-zeigt-mitschueler-wegen-nazi-spruechen-an-a-1176932.html\nhttps://www.pro-medienmagazin.de/medien/fernsehen/2017/10/27/muslimische-jungs-schlagen-juedischen-schueler/\n\nMeine Youtube Kanäle \n\n►iKuchen: https://www.youtube.com/ikuchen\n►Gameplay Kanal: https://www.youtube.com/KuuchenGeschmack\n►Dreamcake: https://www.youtube.com/LeIKuchenblogx\n\nADDET MICH:\n►Steam: KuchenTV\n\n►Steam Trade Link ( Spiele, Sammelkarten, Csgo Waffenskins )\nhttps://steamcommunity.com/tradeoffer/new/?partner=49006289&token=Y-BkcwY1\n\nPostfach: \nTim Heldt \nPostfach 2407\n38014 Braunschweig\n\nPakete an:\nTim Heldt\nPostnummer: 843201334\nPackstation 104\nHildesheimer Straße 32, 38114 Braunschweig.\n\n\nDie Amazon-Links hängen mit dem Partnerprogramm von Amazon zusammen. Sie dienen dem potentiellen Käufer als Orientierung und verweisen explizit auf bestimmte Produkte. Sofern diese Links genutzt werden, kann im Falle einer Kaufentscheidung eine Provision ausgeschüttet werden.\n\nDer MMOGA-Link hängt mit dem Partnerprogramm von MMOGA zusammen. Sofern diese Links genutzt werden, kann im Falle einer Kaufentscheidung eine Provision ausgeschüttet werden.\n\nDer INTOTHEAM-Link hängt mit dem Partnerprogramm von INTOTHEAM zusammen. Sofern diese Links genutzt werden, kann im Falle einer Kaufentscheidung eine Provision ausgeschüttet werden.",Mecklenburg Vorpommern,53.63330408,11.41669861,POINT (11.41669861 53.63330408)
ZGBZVovL3Yo,17.14.11,"News - Rich Pianas Autopsiebericht veröffentlicht, Hardgainer Song, Sophia Thiel Body Update",Gannikus.com,17,2017-11-12T17:39:09.000Z,"gannikus|""test""|""supplement""|""shop""|""deal""|""lifestyle""|""bodybuilding""|""bodybuilder""|""fitness""|""sup""|""booster""|""pre workout""|""eiweiss""|""eiweiß""|""protein""|""diät""|""ernährung""|""gym""|""workout""|""motivation""|""riegel""|""muskelaufbau""|""muskelwachstum""|""training""|""gewichttraining""|""weight training""|""hanteln""|""muskeln""|""zec+""|""hardgainer Crew""|""kollegah""|""farid bang""",30907,1766,81,311,https://i.ytimg.com/vi/ZGBZVovL3Yo/default.jpg,False,False,False,"😮 Hier die 📘 📕 📙ELEMENTS Leseprobe kostenfrei abstauben 👉👉 \nhttps://gannikus.com/shop/leseprobe-gannikus-elements/\n\n💌 💌 💌Jetzt beim Gannikus Whatsapp Newsletter anmelden! 💌 💌 💌 http://gannikus.com/newsletter\n\nHier bei Youtube abonnieren\n⏩⏩ https://www.youtube.com/subscription_center?add_user=gannikuscom\n\nVerpasse keinen Beitrag mehr und like uns auf Facebook!\n👊🏽👊🏽👊🏽 http://facebook.com/gannikuscom\n\nMelde dich im besten Gym Deutschlands an! ▶️ ▶️ http://www.fit-one.de/\nTriff Marcel bei den folgenden nächsten FitOne Eröffnungen:\n🏋️‍🏋️‍🏋️‍♀️    30.11. FitOn  Ingolstadt\n🏋️‍🏋️‍🏋️‍ 02.12. FitOne Chemnitz\n🏋️‍🏋️‍🏋️‍ 15.12. FitOne Magdeburg\n🏋️‍🏋️‍🏋️‍ 22.12. FitOne Hamburg Harburg\n········································­········································­····\n❗❗❗Musik fürs Gym kostenfrei für euch!❗❗❗\n\n🎧🎧 Galenikus Gym Blaster:\nhttps://open.spotify.com/user/21uubvldfxy26qar3sjkmkoay/playlist/3vyIRMSLps4fMmnF2qul2M\n\n🎤🎤 Chillax and Gain:\nhttps://play.spotify.com/user/21uubvldfxy26qar3sjkmkoay/playlist/0Rf6kmVDsxsYjlHGPUaeaV\n········································­········································­····\nInstagram: Bitte folgen 😃 😃\n⏩⏩ https://instagram.com/gannikuscom\n\n⚡️⚡️Marcel bei Instagram\nhttps://www.instagram.com/galenikus_galactus/\n\n🐶🐶 Kimbo bei Instagram \nhttps://www.instagram.com/wildboy_kimbo/\n········································­········································­····\nKommt in unsere Facebook Gruppe, falls ihr irgendwelche Fragen habt. 💪💪\n⏩ https://www.facebook.com/groups/806266916087682/\n\n📰 📺📻 Was wir diese Woche so los in der Fitness-Welt? Hier unsere Zusammenfassung! 📰 📺📻\n\n⚡️⚡️03:10 Karl Ess: „Mit Ralf Sättele habe ich nichts mehr zu tun.“\nhttp://www.gannikus.com/news/karl-ess-mit-ralf-saettele-habe-ich-nichts-mehr-zu-tun/\n\n⚡️⚡️05:53 Eddie Hall – Die gesundheitlichen Folgen des 500kg Deadlifts!\nhttp://www.gannikus.com/news/eddie-hall-die-gesundheitlichen-folgen-des-500kg-deadlifts/\n\n⚡️⚡️08:13 „Pumping Gym“ – Das neue Fitness Studio von Ercan und Sophia?!\nhttp://www.gannikus.com/news/pumping-gym-das-neue-fitness-studio-von-ercan-und-sophia/\n\nBody Update von Sophia Thiel!\nhttp://www.gannikus.com/news/body-update-von-sophia-thiel/\n\n⚡️⚡️11:39 Autopsiebericht von Rich Piana veröffentlicht!\nhttp://www.gannikus.com/news/autopsiebericht-von-rich-piana-veroeffentlicht/\n\n⚡️⚡️17:01 Markus Rühl verrät: Matthias Botthof verlässt TEAM ANDRO!\nhttp://www.gannikus.com/news/markus-ruehl-verraet-matthias-botthof-verlaesst-team-andro/\n\n⚡️⚡️20:17 Johannes Luckas in der Tchibo Werbung!\nhttp://www.gannikus.com/news/johannes-luckas-in-der-tchibo-werbung/\n\n⚡️⚡️22:09 „STOFF“ – Hardgainer Crew veröffentlicht eigenes Musikvideo!\nhttp://www.gannikus.com/news/stoff-hardgainer-crew-veroeffentlicht-eigenes-musikvideo/\n········································­········································­····\nReal Reviews. Pure Lifestyle.\nhttp://www.gannikus.com \n········································­········································­····\nGannikus im Netz:\n👉 Website: http://www.gannikus.com\n👉 Facebook: http://facebook.com/gannikuscom\n👉 Facebook Gruppe: https://www.facebook.com/groups/80626...\n👉 GooglePlus: https://plus.google.com/+GannikusCom/...\n👉 Instagram: https://instagram.com/gannikuscom/\n········································­········································­····",Baden Wurttemberg,48.99999229,8.399993448,POINT (8.399993448 48.99999229)
CXaufwUE_e4,17.14.11,Jupp Heynckes rät FC Bayern zu Knaller-Transfer | SPORT1 TRANSFERMARKT,SPORT1,17,2017-11-13T14:52:57.000Z,"SPORT1|""News""|""Fußball""|""Bundesliga""|""FC Bayern""|""FC Bayern München""|""Jupp Heynckes""|""Timo Werner""|""RB Leipzig""|""Corentin Tolisso""|""Uli Hoeneß""|""Manchester United""|""Jose Mourinho""|""Emil Forsberg""|""Franck Ribery""|""Julian Draxler""|""PSG""|""Paris St. Germain""|""Wechsel""|""Gerüchte""",66652,1509,30,180,https://i.ytimg.com/vi/CXaufwUE_e4/default.jpg,False,False,False,"41,5 Millionen Euro kostete der Rekordtransfer des FC Bayern - für Trainer Jupp Heynckes viel zu wenig. Er wünscht sich einen Mega-Einkauf. Außerdem: Mourinho jagt einen Bundesliga-Star.\n\n► Jetzt Abonnieren: http://bit.ly/1V6Ik2W\n► Folge uns auf Facebook: http://on.fb.me/1non9bf\n► iM Football – Der Fan-Messenger: http://www.imfootball.de\n► SPORT1 eSports auf YouTube: http://bit.ly/1WQ9wDK \n► Hier geht's zur SPORT1 Videowelt: http://bit.ly/1U10yE0",Bremen,53.55043805,8.579982461,POINT (8.579982461 53.55043805)
yq-S3TMtW64,17.14.11,Outlander Episode 3x09 Jamie And Claire Hot Scene On The Board,Celeb Interview,1,2017-11-12T15:17:24.000Z,"Outlander Episode 3x09|""Outlander Episode 3x09 promo""|""Outlander Episode 3x09 trailer""|""Outlander Episode 3x09 review""|""Outlander Episode 3x09 spoiler""|""trailer""|""promo""|""spoiler""|""review""|""Hot Scene""|""outlander 3x09 preview""|""sam heughan""|""outlander season 3""|""outlander""|""outlander season 3 episode 9 promo""|""outlander starz""",36503,264,4,8,https://i.ytimg.com/vi/yq-S3TMtW64/default.jpg,False,False,False,Outlander Episode 3x09 Jamie And Claire Hot Scene On The Board.\n\n\n\nOutlander season 3 Episode 09 review best moments and scenes.\nOutlander season 3 Episode 10 review best moments and scenes.,Hessen,51.30000694,9.500029662,POINT (9.500029661999999 51.30000694)
_PuX0A35lAI,17.14.11,Lets Bastel News #64 | News rund um den Kanal,Lets-Bastel,24,2017-11-13T18:00:02.000Z,"handwerken news|""heimwerken news""|""lets bastel news""|""Heimwerken""|""lbn""|""lets Bastel""|""diy news""|""handwerken tipps""",13690,595,148,562,https://i.ytimg.com/vi/_PuX0A35lAI/default.jpg,False,False,False,"Es ist bald Weihnachten und nicht allen ist es vergönnt, so gut zu speisen und zu feiern wie uns. Deswegen hier ein Aufruf an euch:\nWenn ihr etwas abzugeben habt, sei es Geld oder Werkzeugspenden\ndann beteiligt euch an der Aktion!\n\nLets Bastel Webseite NEU:\n→www.Lets-Bastel.de\n\nEbay Auktion Vogelhaus:\n➞https://goo.gl/UKpB7q\n\n💰 💵  Spenden per Paypal an 💸\n→info@Lets-Bastel.de\n\n🛠  🔨 Werkzeugspenden schicken an\nRoswitha Schleyer\nAm Frickenland 2\n87437 Leubas\n\n\nYouTube Kanal „HobbyMaschine“\n https://www.youtube.com/channel/UCKpRpKMvi-lmiCvTA51Ub6g\n----------------------------------------------------------------\n 🛠  Mein gesamtes Werkzeug findest du hier*:\n→ http://short.t-designz.de/V45MA \n \n▶︎ Diese Teile brauchst du für eine Absauganlage*:\n→ Einschaltautomatik : \n     http://short.t-designz.de/3Zgrk\n→ Zyklon: \n     http://short.t-designz.de/IypsE\n→ Blechfaß: \n     http://short.t-designz.de/PEd0h\n \n🛠  Mit diesem Werkzeug arbeite ich:*\n→ Leimspender Glue Bot: \n     http://short.t-designz.de/SgJOF\n→ Kreisschneider: http://short.t-designz.de/g7rnQ\n→ Holzleim: http://short.t-designz.de/vUyf3\n→ Oberfräse klein: http://short.t-designz.de/szLOX\n→ Klebeband Gehrungen: http://amzn.to/2vRKzCW\n→ Oberfräse groß: http://short.t-designz.de/rAYjO\n→ Kreissäge: http://short.t-designz.de/CinFg\n→ Kappsäge: http://short.t-designz.de/Ihgsm\n→ Kreissägeblatt: http://short.t-designz.de/gTnJP\n→ Bandsägeblätter: http://short.t-designz.de/yBXh1\n→ Forstnerbohrer: http://short.t-designz.de/S8NHz\n→ Holzbohrer: http://short.t-designz.de/YiQDM\n→ Einhandzwingen:  http://short.t-designz.de/VBGtu\n→ Fräser und Holzbohrer:\n     http://short.t-designz.de/bFfEq\n→ Starret Kombiwinkel:\n     http://short.t-designz.de/wErVl\n \n🔨 Shop für Handwerkerbedarf: \n       http://short.t-designz.de/1s3aQ\n \n👕  Meine Arbeitskleidung: \n       http://short.t-designz.de/zaltF\n \n🖥  Webseite Lets Bastel: \n       http://short.t-designz.de/4cJKL\n👬  Lets Bastel Forum: \n       http://short.t-designz.de/gVbM1\n \n🙋🏼  Lets Bastel Fanshop: \n       http://short.t-designz.de/Vtdc6\n🎁  Amazon Wunschliste: \n       http://short.t-designz.de/jIq2W\n💲  Unterstütze Lets Bastel auf Patreon: \n       http://short.t-designz.de/yIzuO\n \n🌞 Social Media \n→  Facebook: \n      https://www.facebook.com/Letsbastel \n→  Instagram: Lets_Bastel\n----------------------------------------------------------------\nMeine Videos enthalten bezahlte Produktplatzierungen\n \nAlle Links mit * sind Amazon Affiliate Links. \nLets Bastel ist Partner am Amazon Affiliate Partner Programm\n \n \nBei diesem Kanal geht es meistens um Holzwerken und Handwerkzeuge. Inspiration und Anregungen für euch zum Basteln. Nützliche Vorrichtungen für Kreissäge/Oberfräse und andere Werkzeuge.",Nordrhein Westfalen,52.02998822,8.530011351,POINT (8.530011351000001 52.02998822)
kevrZ_P4VLI,17.14.11,Torsten Sträter: Die neue Achse des Bösens - Blasentee - NightWash,MySpassde,24,2017-11-12T16:00:03.000Z,"NightWash|""TV""|""Show""|""WDR""|""ONE""|""Stand-Up""|""Comedy""|""Comedian""|""Waschsalon""|""Knacki Deuser""|""clips""|""online schauen""|""Humor""|""ganze Folge""|""Thorsten Sträter""|""Bubble Tea""|""Kirmes""|""Dortmund""|""Bombe""|""Pokemon""|""Blasentea""|""Achse des Bösen""",17747,583,20,14,https://i.ytimg.com/vi/kevrZ_P4VLI/default.jpg,False,False,False,"Die Amerikaner haben erneut angegriffen: Bubbletea oder die deutsche, deutlich ekeligere Variante Blasentee. Torsten Sträter verrät das unfassbare Geheimnis der amerikanischen Geschmacksexplosion. Und so viel sei verraten: nicht jedes Pokémon überlebt die Zubereitung.\n\nVom 18. Oktober 2012\n\nDie ganze Folge auf MySpass: http://www.myspass.de/10293\n\nJetzt Abonnieren: http://bit.ly/1aYTIZV\n\n\n\nMySpass bei facebook: http://www.facebook.com/myspass\nMySpass bei twitter: https://twitter.com/MySpassde",Bayern,50.26660748,10.96660681,POINT (10.96660681 50.26660748)
