video_id,trending_date,title,channel_title,category_id,publish_time,tags,views,likes,dislikes,comment_count,thumbnail_link,comments_disabled,ratings_disabled,video_error_or_removed,description,state,lat,lon,geometry
JlJ9lgfaWrc,17.14.11,"Слуга Народа 2 - От любви до импичмента, 21 серия",Слуга народа,43,2017-11-13T18:46:28.000Z,"сериал слуга народа 2|""слуга народа 2""|""слуга народа 2 сезон""|""слуга народа сериал""|""слуга народа 21 серия""|""слуга народа новый сезон""|""новый сезон слуга народа""|""слуга народа премьера""|""слуга народа смотреть онлайн""|""сериал слуга народа онлайн""|""смотреть новый слуга народа""|""слуга народа""|""sluga narodu""|""слуга народа квартал 95 смотреть""|""слуга народа когда выйдет""|""сериал в 4к""|""премьера 4к""|""сериал 2017""|""премьера 2017""|""президент Украины""",293205,6706,195,652,https://i.ytimg.com/vi/JlJ9lgfaWrc/default.jpg,False,False,False,"Ze Kubiki - Спортивный влог Владимира Зеленского https://www.youtube.com/watch?v=8BCGAqFamk8\n\nСлуга Народа 2 сезон, серия 21: Василий Голобородько в очередной раз действует нестандартно и отдает свои 2 миллиона, которые предназначались на предвыборную кампанию, на обустройство новых пешеходных переходов в стране, после чего, вопреки всем прогнозам, выходит на первое место в рейтинге кандидатов, что в свою очередь становиться полной неожиданностью для олигархов и подталкивает их к новым действиям против Васи.\n\nСлуга народа 2. От любви до импичмента, все серии - https://www.youtube.com/watch?v=uNbPwegQcag&list=PLSoP62RB3ymkpI7XMMeKs2J1rxmmR3UjG\nОднажды под Полтавой, 4-й сезон 2017 - https://www.youtube.com/watch?v=D4DJ0702OY0&list=PLprXcH5dhunNOvBrziCD5qPYOIMuS-mOT\nВечерний квартал полные выпуски - https://www.youtube.com/watch?v=U9Z01WDAS_s&list=PL58H4uS5fMRzV7nPb-plAadLKf5uA6wu3\nПремьера! Звездные яйца 2017 - https://www.youtube.com/watch?v=2qzEG7DLPcY&list=PL58H4uS5fMRwoHUjf6LSWhLa5a9i0rd-P\nРассмеши Комика 2017 - новый 14 сезон - https://www.youtube.com/playlist?list=PLVgj_ENHZ-jWr18s6dZEFze4QKJJ2ISKh\nСериал комедия Країна У / Краина У - Новый 7-й сезон - https://www.youtube.com/watch?v=M3qVonG1q-M&list=PLprXcH5dhunPAoBulZIXYDDmgP_fLKyIE\nЛига Смеха 2017 - 3 сезон - полные выпуски - https://www.youtube.com/watch?v=f2O_8MEICKw&list=PLP8qlV2aurYopmUJRNwyDb30OzlSyM6wS\nІгри Приколів - повні випуски https://www.youtube.com/watch?v=Ph08__WYeTE&list=PL58H4uS5fMRyWbYgQiUm-uKeOoeuxPDMs",Niedersachsen,53.1299986,8.220004434,POINT (8.220004434 53.1299986)
JzCsM1vtn78,17.14.11,THE LOGANG MADE HISTORY. LOL. AGAIN.,Logan Paul Vlogs,24,2017-11-12T20:19:24.000Z,"logan paul vlog|""logan paul""|""logan""|""paul""|""olympics""|""logan paul youtube""|""vlog""|""daily""|""comedy""|""hollywood""|""parrot""|""maverick""|""bird""|""maverick clothes""|""logan paul dubai""|""dubai""|""logan paul uae""|""uae""|""logan paul meet and greet""|""logan paul meet up""|""logan paul dubai mall""|""the dubai mall""|""logan paul arab""|""arabic""|""arab""|""logan paul age""|""the maverick""|""maverick merch""",4477587,292837,4123,36391,https://i.ytimg.com/vi/JzCsM1vtn78/default.jpg,False,False,False,"Join the movement. Be a Maverick ► https://ShopLoganPaul.com/\nNO ONE CAN STOP US. \nSUBSCRIBE FOR DAILY VLOGS! ► http://bit.ly/Subscribe2Logan\n\nMusic:\nExistence Problem - Marius\nhttps://fanlink.to/MariusExistenceProblem2017\n\nAnimal - The Siege\nhttps://soundcloud.com/theseigemusic/animal\n\nCtrl+Alt+Del - The Siege\nhttps://soundcloud.com/theseigemusic/ctrlaltdel\n\nWatch Yesterday’s Vlog  ► https://youtu.be/TIqqEJg4q7c\n\nADD ME ON:\nINSTAGRAM: https://www.instagram.com/LoganPaul/\nTWITTER: https://twitter.com/LoganPaul\n\nI’m a 22 year old kid living in Los Angeles. I make comedy vids, travel a lot, I have a pretty colorful parrot named Maverick and a savage dog named Kong. This is my life.\nhttps://www.youtube.com/LoganPaulVlogs",Hamburg,53.55002464,9.999999144,POINT (9.999999144 53.55002464)
fe77K74czdA,17.14.11,STRANGER THINGS THEME trifft auf WEST COAST VIBEZ | ► BEAT MAKING - BOF #13 || ONEDAH,ONEDAH - The Hitwonder | Beats on Fleek,24,2017-11-12T15:12:04.000Z,"stranger things theme|""west coast beat""|""beat making""|""beats on fleek""|""onedah""|""stranger things beat""|""making a beat""|""stranger things remix""|""beat making fl studio""|""rap beat 2018""|""hip hop beat 2018""|""stranger things theme remix""|""making a stranger things beat""|""making a beat fl studio""|""making a beat from scratsch""|""Hiphop.de""",31016,819,21,61,https://i.ytimg.com/vi/fe77K74czdA/default.jpg,False,False,False,"Freunde, ich präsentiere euch meine Making a Beat Serie Beats On Fleek. In dieser Folge zeige ich euch wie ich aus dem Stranger Things Theme Song einen West Coast Beat in FL Studio baue. Gebt dem Video nen Daumen hoch und hinterlasst feedback, wenns euch gefällt. 👍 Für mehr Beat Making Videos abonniert meinen Kanal! Lasst uns die 10K knacken Freunde! Viel Spaß mit dem Video ✌️\n➡️ ABONNIEREN: https://goo.gl/RgCE1R ⬅️\n\nAlle Beats die ich produziere entstehen in FL Studio. Ein Beatprogramm was ich schon seit Tag 1 nutze. Mein Stil ist sehr stark geprägt von Producern wie Ryan Leslie, Timbaland, DJ Premier und Scott Storch. Ob Trap Beats oder Hip Hop Beats. Ich versuche dabei so vielfältig und kreativ wie möglich zu sein um mich von der Masse abzuheben. Das heisst, auch wenn ich mal mit dem Trend gehe, versuche ich dennoch in jede Beat Produktion meinen eigenen Stil mit einfließen zu lassen.\n\n🛒 Beat Store | http://onedah.com\n💯 Abonniert | http://bit.ly/1lqPoc4\n📨 Offers & Discounts | http://eepurl.com/byDt2L\n📥 Free Beats Download | https://soundcloud.com/onedahmusic/3-free-beats-by-onedah-buy-free-download-hip-hop-rb-trap\n\n📘 Facebook | https://www.facebook.com/onedahmusic\n🐦 Twitter | https://twitter.com/OnedahHitwonder\n☁️ Soundcloud | https://soundcloud.com/onedahmusic\n📷 Instagram | http://instagram.com/onedah\n👻 Snapchat | @onedahhitwonder\n📧 Email | info@onedah.com\n\n--------------------------------\n🎧 Songs 🎧\n--------------------------------\n► Feature Songs:\nJ. WHITE Feat. ONEDAH - Hannah Montana\nItunes: http://apple.co/2zTzZJ3\n\n► Produzierte Songs:\nNanik - Ich mach mein Ding\nhttp://apple.co/2yXmpFl\n\nNanik - Ünal (Album)\nAuf die Maafakka (Prod. by Onedah)\nShit Boy (Prod. by Onedah)\nhttp://amzn.to/2gVqXaA\n\n--------------------------------\n🎧 Beat Playlists 🎧\n--------------------------------\nR&B Instrumental Beats \n➡️ https://www.youtube.com/playlist?list=PLm7JRA2wNgBUulg3cvbDhEnxlvSrDMPW8\n\nHip Hop Instrumental Beats \n➡️ https://www.youtube.com/playlist?list=PLm7JRA2wNgBW3oxgwmKCr6HitcfYYTy6t\n\nTrap Instrumental Beats \n➡️ https://www.youtube.com/playlist?list=PLm7JRA2wNgBUSrpN2fZk9bGKR7CLRCphK\n\nBeat Making Videos \n➡️ https://www.youtube.com/playlist?list=PLm7JRA2wNgBVtKJ49YMMd0phcM3lTM7dc\n\n--------------------------------\nEnglish Description:\n--------------------------------\nWelcome to the official Youtube channel of ONEDAH - The Hitwonder. If you're looking for more type beats like this SUBSCRIBE NOW! You Got The Lyrics! I Got The Hits! I provide Artists with the hottest and unique beats. Best Type Beats for Best Prices. Onedah.com is your #1 source for the most unique Rap, R&B, Hip Hop & Trap beats on the net. New Beat Making Videos every Week!\n\nI proudly presents my Brand New Beat Making Series Beats on Fleek. I will be making hip hop beats, rap beats, trap beats and many more throughout these episodes. So enjoy and make sure to drop a comment of what you think & Please LIKE / Subscribe!🙏 \n\nYou will find everything about making a beat from scratsch, stranger things theme, how to make beats, beat making in fl studio and making a trap beat on this Channel.\n\nSTRANGER THINGS THEME trifft auf WEST COAST VIBEZ | ► BEAT MAKING - BOF #13 || ONEDAH\nhttps://youtu.be/fe77K74czdA",Thuringen,50.97005292,11.02996212,POINT (11.02996212 50.97005292)
ypdHIAAR1aw,17.14.11,Fußballchallenge GEGEN MEINE FREUNDIN (+Arschbolzen),GoalKEEPERz,17,2017-11-12T12:00:06.000Z,"GoalKEEPERz|""Goalkeeper""|""Torwart""|""Torspieler""|""fußballchallenge vs freundin""|""fußbll challenge""|""challenge mit freundin""",167162,15451,423,617,https://i.ytimg.com/vi/ypdHIAAR1aw/default.jpg,False,False,False,❤Kostenlos Abonnieren► https://goo.gl/udo6Z7\n❤FUßBALL LIFESTYLE KLAMOTTEN► http://www.gkzclothing.de\n❤DIE BESTEN HANDSCHUHE► http://ks.zone/e2/p659\n\n🔥Zu MissGKZ\n►https://www.instagram.com/missgkz/\n\n❤Die beste Torwartausrüstung\nKS Handschuhe►https://ks.zone/e2/p6590\nADIDAS SET►https://ks.zone/e2/Set-A16\nUNDERWEAR►https://ks.zone/e2/s1519\nKS Klamotten►https://ks.zone/e2/p6594\n\n🔥Mein Social Media\n✘INSTAGRAM► gkzkarol\n✘SNAPCHAT► gkzkarol\n✘FACEBOOK► gkzkarol\n✘TWITTER► gkz_karol\n\n🔥Wichtige Playlisten \n✘Was sind die besten Handschuhe►https://goo.gl/ynCpgB\n✘Werde ein besserer Torwart►https://goo.gl/O2w7xS\n✘VLOGS►https://goo.gl/3krSEp\n✘Challenges► https://goo.gl/FtgRS6\n✘KEEPERBATTLE's► https://goo.gl/AnuxF7,Schleswig Holstein,54.78374778,9.433315388,POINT (9.433315388 54.78374778)
SFjU8cQQlnY,17.14.11,SA4 - NEUE DEUTSCHE QUELLE (LTD. Boxset) UNBOXING,AdlerssonReview,10,2017-11-12T19:49:15.000Z,"maxhifikanal|""maxherzberg""|""review""|""AdlerssonPictures""|""unboxing""|""sa4""|""bombay sa4""|""187""|""strassenbande""|""maxwell""|""lx""|""gzuz""|""bonez mc""|""faruk111er""|""kuku""|""azad""|""capital bra""|""gringo""|""44""|""zuna""|""kmn""|""azet""|""nash""|""miami yacine""|""kollegah""|""farid bang""|""jbg 3""|""hype""|""mois""|""bonus""|""ep""|""boxhandschuhe""|""pusher""|""tasche""|""ott""|""haze""",92278,4527,147,495,https://i.ytimg.com/vi/SFjU8cQQlnY/default.jpg,False,False,False,"BOX *► http://amzn.to/2jkJ6zu\nMP3 *► http://amzn.to/2zBtLAG\nMESSER *► http://amzn.to/2huO10p\n\nAdlerssonPictures ► https://www.youtube.com/c/adlerssonpictures\n\nMerch / Fanshop ► https://www.seedshirt.de/shop/adlerssonpictures\n\ngrundlos Spenden ► https://www.paypal.me/AdlerssonPictures\n\nGünstig neue Spiele online kaufen *► http://mmo.ga/sx3W\n\nSocial Networks: \n \nFacebook ► https://www.facebook.com/adlerssonpictures\nInstagram ► http://instagram.com/adlerssonpictures\nTwitter ► https://twitter.com/MaxAdlersson\n\nAdresse für Fanpost: \nMax Herzberg\nPostnummer: 901138041\nPackstation 108\nFriedrich-List-Platz 2, 01069 Dresden\n\n'Werbelinks & Empfehlungen' bzw mein Epuipment \n\nHandy *► http://amzn.to/2z58UmW\nMaus *► http://amzn.to/2zceXZd\nNotebook *► http://amzn.to/2ilSiiW\nKamera *► http://amzn.to/2hw7Jph\nSmartwatch *► http://amzn.to/2z48r4p\nPC Lautsprecher *► http://amzn.to/2iT3qHQ\nBeleuchtung *► http://amzn.to/2zag4IM\nMikrofon *► http://amzn.to/2iTWNVZ\nAmazon Alexa *► http://amzn.to/2hvEtPl\nBluetooth Lautsprecher *► http://amzn.to/2zdt7t7\n\n*►= Affiliate Link\nDatenschutzerklärung wegen der Verwendung von Werbemitteln aus dem Amazon-Partnerprogramm:\nWir sind Teilnehmer des Partnerprogramms von Amazon EU, das zur Bereitstellung eines Mediums für Websites konzipiert wurde, mittels dessen durch die Platzierung von Werbeanzeigen und Links zu Amazon.de Werbekostenerstattung verdient werden kann. Zur Nachverfolgung der Bestellung setzt Amazon Cookies ein, die es ermöglichen, zu erkennen, dass Sie auf unserer Seite einen Partnerlink angeklickt haben. Weitere Informationen zur Datennutzung durch Amazon erhalten Sie in der Datenschutzerklärung des Unternehmens: https://amzn.to/2on1gB6\n\nImpressum: https://www.youtube.com/user/MaxHifiKanal/about",Brandenburg,51.7704175,14.32996741,POINT (14.32996741 51.7704175)
U3xLOo-CNwo,17.14.11,12 Weird Ways To Sneak Food Into Class / Back To School Pranks,Troom Troom,26,2017-11-12T15:00:05.000Z,"sneak food|""how to sneak food into class""|""class hacks""|""school food""|""food in class""|""sneak food into class""|""how to sneak food into school""|""take food to school""|""weird school supplies""|""school pranks""|""back to school""|""hide food""|""eating in class""|""ways to sneak food into class""|""how to sneak food in class""|""how to sneak food in school""|""best school pranks""|""back to school pranks""|""prank""|""school""",3153224,28451,2285,3312,https://i.ytimg.com/vi/U3xLOo-CNwo/default.jpg,False,False,False,"Subscribe Here: http://bit.ly/2uaz0on\n12 Hot Glue Gun Life Hacks For Crafting: https://youtu.be/RVrUIQAFldU?list=PLy0LaulZe0vSljAapkasaxsIKJp7I-7j0\nIn this video we will continue the theme of weird ways to sneak food into class! We've invented new ways of how to cheat the teacher. There should be no more boredom and hunger in the class!\n\nSupplies and Tools:\n• Candies and cookies\n• Pencil sharpener\n• Notepaper holder\n• Color and scrapbook paper\n• Ruler\n• Craft knife\n• Ziploc bags\n• Felt\n• Marker\n• Hole puncher\n• Ribbon\n• Donut images\n• Hot glue gun\n• Empty school supply containers\n• Wipes \n• Scissors\n• Fanta\n• Funnel\n• Air dry clay\n• Acrylic paint\n• Sponge\n• Stationery holders\n• Jam\n• Pen\n• Tic-Tac \n\nMusic:\nBest Future House Mix 2017 Vol. 1 by Uroš is licensed under a Creative Commons 3.0 Unported License.\nSource: https://soundcloud.com/urosfuturehouse/best-future-house-mix-2017-vol-1  \n\nWatch More Troom Troom: \nPopular Videos:\n18 Funny Pranks! Prank Wars! https://youtu.be/yWazGzCNtJ4\n11 DIY Edible Makeup Ideas/11 Funny Pranks https://youtu.be/kewz3hF63Xo\n14 Weird Ways To Sneak Food Into Class / Back To School Pranks https://youtu.be/W5p2ndS34vA\nDIY Slime Stress Ball— 5 Ideas https://youtu.be/3VH6KeJn-XA\n11 DIY Edible School Supplies / Pranks For Back To School! https://youtu.be/ZMnz2hfmubs\n\nPopular Playlists:\nFunny Pranks: https://www.youtube.com/playlist?list...\nBack to School: https://www.youtube.com/playlist?list...\nLife Hacks: https://www.youtube.com/playlist?list...\nDIY Cosmetics: https://www.youtube.com/playlist?list...\nAwesome Slimes: https://www.youtube.com/playlist?list...\n\nFollow Troom Troom:\nSubscribe: http://bit.ly/2uaz0on\nInstagram: http://bit.ly/2t0BsOK\nFacebook: http://bit.ly/2uf2qTb\nPinterest: http://bit.ly/2tFz9iT\n\nTroom Troom Español: \nSubscribe: http://bit.ly/2uaqyFo\n\nTroom Troom Française:\nSubscribe: http://bit.ly/2vnYmfc\n\nTroom Troom Russian: \nSubscribe: http://bit.ly/2tEWWiQ\n\nTroom Troom Deutsch:\nSubscribe: http://bit.ly/2wo0oOR\n\nTroom Troom Japanese:\nSubscribe: http://bit.ly/2xK2mZv\n\nAbout Troom Troom: \nEasy DIY how to video tutorials. DIY Accessories, Scrapbooking Cards, Home Décor, Make Up Tutorials, Life Hacks, and MUCH more! Make it easy! \n\nFor any business enquires please contact me at: troomtroomdiy@gmail.com\n\nQuestion of the Day: what idea you liked the most? Comment Below!\n\nDon’t forget to turn on notifications, like, & subscribe!",Rheinland Pfalz,49.98247246,8.273219156,POINT (8.273219156 49.98247246)
Wg6a0chf3SI,17.14.11,Wir haben Hunger! - Kinder bitten auf der Straße um Geld | Auf Streife - Berlin | SAT.1 TV,Auf Streife,24,2017-11-12T16:30:00.000Z,"Wir haben hunger! Kinder bitten auf der Straße um Geld|""Kinder haben hunger""|""Kinder fragen auf der Straße nach Geld""|""betteln""|""bettelnde Kinder""|""hunger haben""|""nach Essen fragen""|""Auf Streife""|""Auf Streife Berlin""|""Auf Streife – Die Spezialisten""|""Die Spezialisten""|""Auf Streife ganze Folgen""|""Auf Streife Polizisten""|""Reality TV""|""SAT.1""|""TV show""|""TV""",112372,2984,83,328,https://i.ytimg.com/vi/Wg6a0chf3SI/default.jpg,False,False,False,"Bei einer Fußstreife treffen zwei Berliner Beamte auf zwei Kinder, die auf der Straße nach Essen und Geld fragen. Anfangs trauen diese sich nicht zu sagen, wieso sie in dieser Situation sind. Doch dann löst sich die ganze Situation auf.\n\n►Alle Fälle von Auf Streife im Abo!\nhttp://bit.ly/AufStreifeAbonnieren\n\n►Klinik am Südring auf YouTube\nhttp://bit.ly/2zQTqSF\n\n►Die Ruhrpottwache auf YouTube\nhttp://bit.ly/2iKM3Jn\n\n►Ganze Folgen von „Auf Streife“\nhttp://bit.ly/AufStreifeGanzeFolge\n\n►Ganze Folgen von „Auf Streife – Die Spezialisten“\nhttp://bit.ly/AufStreifeDieSpezialistenOnline\n\n►Ganze Folgen von „Auf Streife – Berlin“\nhttp://bit.ly/AufStreifeBerlinOnline\n\n► Auf Streife auf Facebook:\nhttp://bit.ly/AufStreifeFacebook\n\n\nImmer „Auf Streife“ - Der Polizei-Alltag ist hart und oft gefährlich.\nDie Polizisten sind immer im Einsatz: Tag und Nacht, zwischen Touristen und Obdachlosen, in Villenvierteln und Problemkiezen. Auf Basis echter Fälle wird gezeigt, wie ihr Alltag aussieht: mal skurril oder gefährlich, mal amüsant oder emotional - kein Einsatz ist wie der andere! Die Beamten müssen alles geben, um sich und andere zu schützen. \n\n\nMehr Action auf YouTube:\n► taff: https://www.youtube.com/user/taffOffiziell\n► Frühstücksfernsehen: https://www.youtube.com/user/Sat1FFS\n► kabel eins doku: https://www.youtube.com/channel/UCIjfpxlHpcednFfNkDBReBA\n\n\nImpressum:\nhttp://www.studio71.com/impressum/",Berlin,52.52181866,13.40154862,POINT (13.40154862 52.52181866)
0yIWz1XEeyc,17.14.11,Jake Paul Says Alissa Violet CHEATED with LOGAN PAUL! #DramaAlert Team 10 vs  Martinez Twins!,DramaAlert,25,2017-11-13T07:37:51.000Z,"#DramaAlert|""Drama""|""Alert""|""DramaAlert""|""keemstar""|""youtube news""|""jake paul""|""team 10""|""alissa violet""|""cheated""|""logan paul""|""logan paul alissa violet""|""jake paul alissa violet""|""Martinez Twins""|""left team 10""|""faze banks""|""erika costell""",1309699,103754,4613,12143,https://i.ytimg.com/vi/0yIWz1XEeyc/default.jpg,False,False,False,► Follow for News! - https://twitter.com/KEEMSTAR\n\n► Also follow #DramaAlert on:\n⋆ Instagram: https://instagram.com/DramaAlert\n⋆ Twitter: https://twitter.com/DramaAlert\n⋆ Facebook: https://facebook.com/DramaAlert\n\n► Follow for livestreams! - https://twitch.tv/KEEMSTAR\n\n► KEEM Merch\nhttp://keem.shirtz.cool\n\n► USE CODE (KEEM)\nhttps://gfuel.com/pages/keemstar\n\nDollar in the Woods! (OUT NOW)\n► iTunes\nhttps://itunes.apple.com/us/album/dollar-in-the-woods-single/id1295414119https://itunes.apple.com/us/album/dollar-in-the-woods-single/id1295414119\n\n► Spotify \nhttps://open.spotify.com/track/3uUHoKWqPbJ5qoREGbguC9?si=v4CgSBBR\n\n► YouTube (Music Video)\nhttps://youtu.be/n38Qxi7TVWo\n\nAdpocalypse! (My New Game)\n► Apple (iOS)\nhttps://itunes.apple.com/us/app/the-adpocalypse/id1263621591\n\n► Android\nhttps://play.google.com/store/apps/details?id=com.projectorgames.howtogetahead,Mecklenburg Vorpommern,53.63330408,11.41669861,POINT (11.41669861 53.63330408)
f9cubuZBpxQ,17.14.11,Mehr als nur Marktschreier? Ein eigener Stand auf dem Markt | Galileo | ProSieben,Galileo,24,2017-11-13T17:30:01.000Z,"Mehr als nur Marktschreier? Ein eigener Stand auf dem Markt|""Mehr als nur Marktschreier""|""Ein eigener Stand auf dem Markt""|""Marktschreier""|""Markt""|""Markt Stand""|""Stand auf Markt""|""Markt verkaufen""|""Galileo""|""Galileo 2017""|""TV""|""TV Sendung""|""Sendung""|""Television Program (Media Genre)""|""Galileo Lunch Break""|""Galileo Essen""|""Wissen""|""Foodtrends""|""Aiman Abdallah""|""Stefan Gödde""|""Prosieben""|""Dokumentation""|""Galileo finde den Lügner""|""galileo mystery""|""jumbo schreiner""",23834,643,29,111,https://i.ytimg.com/vi/f9cubuZBpxQ/default.jpg,False,False,False,"Sicher habt ihr beim Shoppen schon mal einen Stand gesehen, wo Leute Haushaltsgeräte verkauft haben. Nah am Kunden ist dieser Job. Doch wie schafft man es, Menschen von einem Produkt zu überzeugen? Und kann man mit Direktverkauf viel Geld verdienen?\n\n►Galileo auf YouTube abonnieren: http://www.youtube.com/subscription_center?add_user=GalileoOffiziell  \n\n►Mehr auf Galileo: http://www.galileo.tv/ \n►FUNDA HAT EINEN KANAL: https://www.youtube.com/user/FundaVanroy \n\n►Alle Videos findest du auf http://www.prosieben.de/tv/galileo/videos\n\nGalileo ist die ProSieben Wissenssendung mit Aiman Abdallah, Stefan Gödde und Funda Vanroy. Täglich um 19.05 Uhr kannst Du auf ProSieben die Welt kennen und verstehen lernen. Galileo nimmt Dich mit auf eine Reise durch das Wissen: Physik, Geschichte, Natur und Internetphänomene, Gesellschaft, Politik und alltägliche Fragen. Die Hosts Harro Füllgrabe, Jan Schwiderek, Jumbo Schreiner, Klas Bömecke, Matthias Fiedler, Akif Aydin und Dionne Wudu nehmen dabei vollen Körpereinsatz in Kauf und gehen allem auf den Grund, was uns interessiert.\n\n-----------------------------------------------------------------------------------------------\n\nImpressum:\nhttp://www.studio71.com/de/impressum",Sachsen,50.82998395,12.91997595,POINT (12.91997595 50.82998395)
7dMMXIlIbJ8,17.14.11,Klavye Delikanlıları 6. Bölüm,Klavye Delikanlıları,22,2017-11-12T20:45:31.000Z,"klavye delikanlıları|""süreç film""|""murat şeker""|""ali tanrıverdi""|""Ali Gündoğdu""|""Yahya Samancı""|""Rasim Öztekin""|""Kaan Yıldırım""|""Vildan Atasever""|""Uraz Kaygılaroğlu""|""Ali Barkın""|""Selen Seyven""|""Seray Sever""|""Gül Onat""|""Cengiz Küçükayvaz""|""Filiz Taşbaş""|""İpek Tanrıyar""|""Mert Asker""|""showtv""|""fragman""|""tanıtım""|""klavye delikanlıları fragman""|""kdtam""",71571,1306,45,170,https://i.ytimg.com/vi/7dMMXIlIbJ8/default.jpg,False,False,False,"Bu dizi ve çok daha fazlası puhutv'de → https://puhutv.com/klavye-delikanlilari-detay?utm_medium=referral&utm_source=youtube&utm_campaign=klavye_delikanlilari&utm_content=detay\n\nKlavye Delikanlıları'na Abone Olmak İçin → bit.ly/kd-dd-sub\n\nKlavye Delikanlıları 6. Bölüm Özet:\n\nKomiser Cevdet ve Komiser Sibel’in işbirliğiyle yakalanan Kerem, panik ataklar geçirse de durumu kurtarmak için çabalamakta, Selen ise Kerem’i tamamen kaybettiği gerçeğiyle yüzleşmek zorundadır. \nBütün aksiliklere rağmen sıkı bir şekilde Sosyal Medya Olimpiyatları’na hazırlanmaya devam eden ekibimiz, yarışma için birbirinden eğlenceli kategoriler bulmaya ve sponsor aramaya etmektedir. \nBu sırada Bayram ve Seyran da birbirlerine meydan okudukları riskli bir yarışa girmişlerdir; Kokoreç ve midye! \nHiko  Dayı, Nergis’in ev işlerine yardım etmeye çalışırken mahalleye neden geri döndüğünü öğrenip allak bullak olur. Seçici bir şekilde Sosyal Medya Olimpiyatları için  başvuruda bulunan gençlerle ilgilenen Kuzen Volki ise hayatında hiç tatmadığı bir hisle tanışacaktır. \nYarışmayı kazanmak için tüm şartları ayarladığını düşünen Klavye Delikanlıları’nın yeni nesil gençlikle sınavı nasıl geçecek?  Bu bölümde de aksiyon ve eğlence yine ekibimizle beraber olacak.\n\nYapım: Süreç Film\nSenaryo: Murat Şeker, Ali Tanrıverdi\nYönetmen: Yahya Samancı\n\nOyuncu Kadrosu:\nHiko Dayı: Rasim Öztekin\nKerem Tanrıverdi: Kaan Yıldırım\nKuzen Volki: Uraz  Kaygılaroğlu\nSeyran: Vildan Atasever\nBayram Şeker: Ali Barkın\nSelen: Selen Seyven",Bayern,50.26660748,10.96660681,POINT (10.96660681 50.26660748)
nWGKA8OULxU,17.14.11,Beni Affet 1253. Bölüm,Beni Affet,1,2017-11-13T14:18:16.000Z,"beni affet dizi|""ceren yalazoğlu""|""beni affet youtube""|""beni unutma""|""mert altınışık""|""beni affet dizisi""|""gaye turgut""|""nusret şenay""|""Beni affet son""|""şeyma korkmaz""|""beni affet oyuncuları""|""affet beni izle""|""beni affet facebook""|""gamze iğdiroğlu""|""murat danacı""|""beni affet star""|""batam""|""Beni Affet 1253. Bölüm""",123529,1370,180,255,https://i.ytimg.com/vi/nWGKA8OULxU/default.jpg,False,False,False,Beni Affet'e dair her şey startv.com.tr'de → http://www.startv.com.tr/dizi/beniaffet\n\nBeni Affet’e abone olmak için →  http://bit.ly/ba-dd-sub\n\nSadece kendi doğrularını çocuklarına dayatan ve tek tek hepsini mutsuz eden bir babanın ve babalarının günahı yüzünden aşklarını kaybeden çocukların hikayesi...\n\nYapım: Focus Film\n\nBA,Mecklenburg Vorpommern,53.63330408,11.41669861,POINT (11.41669861 53.63330408)
